0|0|Avec des Miam, tout est possible.
0|0|La clé de tes désirs est dans ta poche...
0|0|Les 7 orbes exauceront tous tes vœux.
0|1|Le chaos-mètre est au maximum !
0|1|Les Chats diplômés te guideront vers le succès !
0|1|Tu auras les meilleures notes à Nyarvard !
0|2|Une mystérieuse jeune femme descendra du ciel !
0|2|Les 7 dieux de la chance t’apparaîtront !
0|2|Tu vas recevoir 100 invités !
0|3|Le marché immobilier va connaître un boum !
0|3|Absolument tout te profitera !
0|3|Il est temps d’encaisser tes Chats dorés.
0|4|... Oublie tout ça et danse avec moi !
0|4|Dans cette réalité temporelle, tu n’as rien perdu.
0|4|N’oublie pas : l’honnêteté est le meilleur choix.
0|5|Cherche un trésor enfoui dans ton jardin.
0|5|Gamatoto va découvrir une formidable source chaude.
0|5|Tu vas clairement choisir les chiffres gagnants au loto.
0|6|Tes talents cachés vont bientôt se révéler.
0|6|Ton voyage au secours du monde va bientôt commencer.
0|6|Ta chaîne va avoir un million d’abonnés.
0|7|Il est temps d’agir. Maintenant !
0|7|La force ultime est à ta portée !
0|7|Tes victoires seront décisives.
0|8|Le Chaman a ce qu’il faut pour te guérir.
0|8|Le seul remède est de devenir un cyborg.
0|8|Tu vas rester en bonne santé... probablement.
0|9|Bientôt, tu vas résoudre l’énigme de l’amour.
0|9|Avec le printemps viendra une nouvelle rencontre.
0|9|Écris une lettre d’amour avec du jus de citron.
1|0|Tu dois croire au pouvoir des Chats !
1|0|Tu peux manger autant de haricots que tu veux.
1|0|Trois étoiles filantes et le Dieu des Chats t’écoutera.
1|1|Tu découvriras bientôt le secret de la motivation.
1|1|Il va falloir te donner à 100 %.
1|1|N’oublie pas ce que t’a enseigné le Professeur Ours !
1|2|Ça va être facile pour toi... trop facile...
1|2|N’oublie pas : la chance se déplace en tricycle.
1|2|Tu vas courir le 100 mètres en 9 secondes.
1|3|Tu auras du succès dans un domaine populaire.
1|3|Tu vas faire des erreurs, mais tu t’en sortiras bien.
1|3|Ces Chagrumes épiques se vendent très bien...
1|4|Ce que tu as perdu est déjà dans la base féline.
1|4|Quelque chose se cache dans la réserve.
1|4|Ce que tu rejettes ne manquera pas de revenir.
1|5|Tu vas trouver un billet de 20 euros dans ton blouson.
1|5|N’oublie pas de faire la vaisselle !
1|5|Certaines choses comptent plus que l’argent.
1|6|Pourquoi ne pas investir dans un second foyer ?
1|6|Arnaque les arnaqueurs avant de te faire arnaquer.
1|6|Tu vas rencontrer des Chats charmants du voisinage.
1|7|Dans tout conflit réside le vide.
1|7|Le maître véritable connaît toujours son ennemi.
1|7|Ne compte pas que sur les ultra rares, d’accord ?
1|8|Une bonne nuit de sommeil guérit de tout.
1|8|Un jour, toi aussi tu auras des rhumatismes.
1|8|N’oublie pas de prendre tes vitamines.
1|9|Tu peux péter les plombs. Tu as le droit.
1|9|Il y a toujours une autre bataille à gagner.
1|9|La douleur du rejet disparaîtra avec le temps.
2|0|Tu vas oublier ton souhait, puis il va se réaliser.
2|0|N’oublie pas de prendre des notes.
2|0|Fais preuve de générosité !
2|1|Il faut de l’argent pour faire de l’argent !
2|1|Vise juste un petit peu plus à gauche.
2|1|Tu vas devenir encore plus doué qu’un Chat numérique.
2|2|La réponse est dans tes rêves.
2|2|Ça arrive... avec 30 minutes de retard.
2|2|Si tu surveilles ta gauche, ça viendra de la droite.
2|3|Tu vas enfin avoir cette promotion.
2|3|Il y a un trésor caché dans ton placard.
2|3|Attends une promo pour acheter des unités spéciales.
2|4|N’oublie pas de changer de mot de passe tous les mois.
2|4|Prends exemple sur l’esprit aventureux de Gamatoto !
2|4|Tu vas peut-être devoir revenir chez maman.
2|5|Ton amulette porte-bonheur se trouve sur ta gauche.
2|5|Affronte l’avenir et marche fièrement vers lui !
2|5|L’hésitation... c’est la défaite.
2|6|Un héros local deviendra ton ami.
2|6|Tes voyages vont très bien se passer.
2|6|Détends-toi et prends confiance en toi.
2|7|Fais juste de ton mieux, d’accord ?
2|7|Ne cède pas à la violence inutile !
2|7|Toutou t’aimera toujours.
2|8|Ne taquine pas les animaux sauvages, ou ils te mordront.
2|8|Pour une peau saine, ne néglige pas le sommeil.
2|8|N’oublie pas le vaccin contre la grippe !
2|9|Plus d’attaques de zone ne font jamais de mal.
2|9|Va main dans la main avec la personne de ton cœur.
2|9|Dis oui. Qui sait ce qui pourrait se passer ?
3|0|Tout dépend de tes efforts.
3|0|Le vrai bonheur se trouve en 2 dimensions.
3|0|Pas grand-chose à dire aujourd’hui.
3|1|La réponse pourrait être dans tes vieux cahiers.
3|1|Tu penses trop aux Chats pour avoir les idées claires.
3|1|Laisse le Dieu des Chats s’en occuper.
3|2|Essaie de faire la queue à l’autre entrée.
3|2|La chance... se trouve dans l’autre hémisphère.
3|2|Lance le signal et il apparaîtra !
3|3|Pas maintenant. Attends deux ans.
3|3|Ouvre une Chapsule pour connaître ton destin.
3|3|Ce Chat si mignon sera bientôt en promo.
3|4|Tu trouveras ce que tu cherches. Mais d’occasion.
3|4|Ce que tu désires se vend aux enchères aujourd’hui.
3|4|Tu trouveras ça dans une boutique d’occasions !
3|5|Tu auras peut-être une augmentation... l’an prochain.
3|5|Tu es parfaitement Feng Shui en ce moment.
3|5|Plus de points et la victoire sera assurée.
3|6|Tu vas te retrouver dans un bouchon de 100 km.
3|6|Ta chance se trouve dans un château conquis.
3|6|Guide tes Chats à travers le monde !
3|7|La retraite apportera une victoire future.
3|7|Maîtrise le bon déploiement des unités super rares !
3|7|Il est temps de passer à la forme ultime !
3|8|La douleur, c’est dans la tête.
3|8|Ne mange pas ce que tu trouves par terre.
3|8|N’oublie pas les étirements avant le sport !
3|9|Exprime ton amour pour tes Chats préférés !
3|9|Prends des photos pour te souvenir de cette journée.
3|9|Covoiturer avec tes amis te portera chance.
4|0|Ton prochain rêve va sûrement se réaliser.
4|0|Sans commentaire.
4|0|Fais un vœu si tu vois un Chat errant. Il se réalisera.
4|1|Ton prochain score sera... mauvais.
4|1|Tu vas faire des progrès... en nettoyage.
4|1|L’école que tu rêves d’intégrer va bientôt fermer.
4|2|Aujourd’hui, tu ne verras que le facteur.
4|2|Un guerrier mystérieux va te proposer un défi.
4|2|Ton visiteur est venu... hier.
4|3|Ne laisse pas les Chats prendre les décisions.
4|3|Personne ne veut de ça, même gratuitement.
4|3|Gory va te voler tes meilleurs clients.
4|4|On dira de ton trésor qu’il est légendaire.
4|4|Ce que tu veux est dans la tanière d’un monstre.
4|4|Tout finira par être échangé contre de l’XP.
4|5|Tu vas trouver 20 euros, mais perdre ton porte-monnaie.
4|5|Ne crois pas ce que dit ce courriel d’un étranger.
4|5|Un Chat va voler toutes tes pièces.
4|6|Ces sources chaudes te donneront des démangeaisons.
4|6|Le souvenir que tu as acheté va se casser.
4|6|Si tu y vas, vas-y aujourd’hui.
4|7|Tu vas perdre face à un Hippo.
4|7|Ne prends pas une flèche dans le genou.
4|7|Miss Panneau va détruire ta base féline.
4|8|Ne te mords pas la joue.
4|8|Ton estomac... est tout bizarre...
4|8|Évite le caramel si tu ne veux pas perdre un plombage.
4|9|Ils veulent juste être amis...
4|9|Bientôt, tous tes amis trouveront l’amour.
4|9|Attention à l’ombre du Chat voleur...
5|0|Ton avidité te perdra.
5|0|Le souhait de ton adversaire va se réaliser.
5|0|Ce dont tu as peur est en fait ta meilleure chance !
5|1|Un Toutou va manger tous tes devoirs.
5|1|Tu vas t’endormir pendant que tu révises.
5|1|Tu ne penseras à rien pendant le prochain quiz.
5|2|Je suis... juste derrière toi !
5|2|Miss Panneau en aura bientôt marre d’attendre...
5|2|Celui que tu attends portera un chapeau très laid.
5|3|Ton équipe d’impro va connaître la faillite.
5|3|Un Chat voleur est chez toi en ce moment !
5|3|Les Toutous vont te fuir...
5|4|Ce que tu veux... est au fond de la mer.
5|4|Rien de ce que tu souhaites ne sera perdu.
5|4|Un proche va acheter ce que tu veux.
5|5|N’achète pas ce vase suspect.
5|5|Attention aux dégâts critiques !
5|5|Un Chat du coin va piller ton compte en banque.
5|6|Tu vas te retrouver à la dérive, au milieu de la mer.
5|6|Tu vas te volatiliser vers un royaume ancien.
5|6|Ne te fais pas aspirer par un trou noir !
5|7|Ce que tu donnes, on te le rendra au centuple !
5|7|Tu es la prochaine cible de l’Ours assassin...
5|7|Tu vas perdre, même avec des "Continuer".
5|8|Tu ferais mieux de garder cette idée pour toi.
5|8|Ce drôle d’eczéma sera guéri dans 3 mois.
5|8|Bientôt, ça se mettra à pousser.
5|9|Cette lettre d’amour a été envoyée par erreur...
5|9|Quand tu te cureras le nez, tout deviendra clair.
5|9|Ton flirt ne comprendra qu’un dixième de tes sentiments.