บททดสอบแดงเลือด|＠||||||||||||||||
บททดสอบเงา|＠||||||||||||||||
บททดสอบฟินิกซ์|＠||||||||||||||||
แผนห้าปี|＠||||||||||||||||
อ่อนแอแห่งวิญญาณ|＠||||||||||||||||
หกปีแกร่งกล้า|＠||||||||||||||||
สู่รอยร้าว: คนรับใช้สไตรก์!|＠||||||||||||||||
อะควาพาราดิโซ|＠||||||||||||||||
Princess Punt's Army|＠||||||||||||||||
|＠||||||||||||||||
โจมตีชากูเรล|＠||||||||||||||||
สภาแวมไพร์|＠||||||||||||||||
ร่ายรำในนภา|＠||||||||||||||||
ความตายจากอวกาศ|＠||||||||||||||||
ฉันมองหาความแข็งแกร่งที่สุด|＠||||||||||||||||
หมายเลข 7 นำโชค|＠||||||||||||||||
เทศกาลดนตรีมิกุมิกุ|＠||||||||||||||||
ทัวร์นาเมนต์น้ำตานอง|＠
ฉันมองหาความแข็งแกร่งที่สุด|＠
8 ก็ไม่พอ|＠
บททดสอบแดงเลือด|＠
บททดสอบเงา|＠
บททดสอบฟินิกซ์|＠
สบายดีตอน 9 โมง|＠
|＠
|＠
งานประชุมเรนเจอร์|＠
The Swords of Meiji|＠
คลื่นโจมตี|＠
|＠
ทัวร์นาเมนต์พรสวรรค์|＠
The Strongest Things|＠
Sonic Battle!|＠
พรสวรรค์ด้านสงคราม|＠
กลัวจนตัวแข็ง|＠