บททดสอบแดงเลือด|＠||||||||||||||||
บททดสอบเงา|＠||||||||||||||||
บททดสอบฟินิกซ์|＠||||||||||||||||
แผนห้าปี|＠||||||||||||||||
อ่อนแอแห่งวิญญาณ|＠||||||||||||||||
หกปีแกร่งกล้า|＠||||||||||||||||
สู่รอยร้าว: คนรับใช้สไตรก์!|＠||||||||||||||||
อะควาพาราดิโซ|＠||||||||||||||||
|＠||||||||||||||||
|＠||||||||||||||||
โจมตีชากูเรล|＠||||||||||||||||
สภาแวมไพร์|＠||||||||||||||||
ร่ายรำในนภา|＠||||||||||||||||
ความตายจากอวกาศ|＠||||||||||||||||
ฉันมองหาความแข็งแกร่งที่สุด|＠||||||||||||||||
หมายเลข 7 นำโชค|＠||||||||||||||||
เทศกาลดนตรีมิกุมิกุ|＠||||||||||||||||
ทัวร์นาเมนต์น้ำตานอง|＠
ฉันมองหาความแข็งแกร่งที่สุด|＠
8 ก็ไม่พอ|＠
บททดสอบแดงเลือด|＠
บททดสอบเงา|＠
บททดสอบฟินิกซ์|＠
|＠
|＠