ถูกจับตัว|		//ガマトト探検ログ表示：述語（ランダム生成）
ค้นพบเมืองลับแล|
กินอาหารที่ตกลงพื้น|
ครุ่นคิดอย่างหนักหน่วง|
ถูกซ้อมจนเละ|
สร้างบ้านในฝัน|
วิ่งจนเหนื่อยหอบ|
เกิดแผลใจถาวร|
เผชิญหน้ากับสิ่งที่กลัวที่สุด|
ติดโรคที่รักษาไม่หาย|
ถูกปฏิเสธ|
ไล่ตามความฝันอันยิ่งใหญ่|
เด็ดดอกไม้|
รู้สึกคัน|
ฉลองวันเกิด|
โดนลวนลาม|
ได้ขนมถุงนึง|
กล่าวปาฐกถาอันทรงพลัง|
ต้องใช้ส้วม|
ไปตีกอล์ฟกับหัวหน้า|
กำลังไฟแรง|
เริ่มงานใหม่|
รู้ว่าตัวเองเป็นลูกเลี้ยง|
โดนขายประกัน|
รู้สึกหมดไฟ|
ทนไม่ไหว|
กินข้าวเย็นกับที่บ้านอย่างสงบ|
งอกปีกและบินหนี|
หัวเราะอย่างเสียงดัง|
แทงหมดหน้าตัก|
ลงทุนในหุ้นแย่|
ร้องไห้จนกระทั่งหัวเราะ|
รู้สึกเขินอาย|
รู้สึกอยากย้ายไปแคนาดา|
ละเมิดคำสาบานศักดิ์สิทธิ์|
ตัดสินใจว่าจะฟ้องร้อง|
ถ่ายรูปวาบหวิว|
พบกับพ่อที่แท้จริง|
ทำให้ฮีโร่ที่ชื่นชอบประทับใจ|
เกือบตายเพราะความอับอาย|
เปลี่ยนตัวตนใหม่|
โดนจับ|
รู้สึกสบายใจเล็กน้อย|
เป็นแรงบันดาลใจให้อนิเมะ|
โดนเนรเทศ|
แจ้งความ|
ถูกแจ้งความ|
ทำทุกอย่างเละเทะ|
โดนขังที่บ้าน|
เรียนรู้ความหมายของชีวิต|
อารมณ์ดีจนเป็นบ้า|
ออกอาละวาด|
ล้มละลาย|
ตื่นรู้|
กินเบอร์เกอร์ที่ดีที่สุด|
ตีลังกาได้อย่างสุดยอด|
ดื่มมากเกินไป|
บรรลุนิพพาน|
กระโดดกลับหลังได้อย่างชำนาญ|
ตั้งมูลนิธิ|
โดนจับขณะล่าสัตว์|
ต่อต้านการจับกุม|
คิดถึงความหลังฝังใจ|
มีกล้ามท้องซิกแพค|
ถูกท้าดวล|
โดนหนูกัด|
รู้สึกหิวอย่างรุนแรง|
พบอะไรบางอย่างน่าสงสัย|
โกรธจนน้ำตาไหล|
เมาหัวราน้ำ|
เผยแผนสมคบคิด|
รู้สึกแย่ที่ทิ้งขยะไม่เป็นที่|
กลัวจนตัวสั่น|
รู้ถึงความน่ากลัวของสงคราม|
กำเนิดใหม่|
สัปหงกแป๊บนึง|
ถามคำถามซ้ำ|
เห็นผีน่ากลัว|
คิดถึงอาหารฝีมือแม่|
ตัดสินใจเป็นมังสวิรัติ|
ตัดสินใจอย่างมุ่งมั่น|
ปล่อยข่าวฉาว|
ตกหลุมรัก|
สร้างปัญหาล้านแปด|
เต้นจนกระทั่งหมดแรง|
รู้สึกเหนียวตัว|
เขียนธีสิสจนจบ|
ไม่กินอะไรเลยนอกจากผักกาด|
สู้เพื่อความสงบสุขของโลก|
รู้ซึ้งถึงการอกหัก|
ลิ้นไหม้|
หาว|
รู้สึกมึนงง|
โดนสะกดรอยตาม|
ทิ้งกางเกงในเก่า|
แสร้งเป็นว่าทำงานหนัก|
ฮัมเพลงอย่างเงียบๆ|
หมดสติ|
สำลักเกือบตาย|
ลงมือทำจนสำเร็จ|
ซื้อโดนัทมากเกินไป|
ให้อาหารเป็ด|
ขโมยขนมจากเด็กทารก|
สงสัยในตัวเพื่อนสนิท|
กรี้ดกร้าด|
ขโมยปากกา|
เป็นอาหารเป็นพิษ|
ได้โศกเศร้าเสียใจ|
ทำงานพาร์ตไทม์|
ตัดสินใจลาหยุด|
ค้นพบความลับอันมืดมิด|
ร่วมงานประชุมสัมมนา|
เล่นเป็นพระเจ้า|
ส่งข้อความผิดไปหาเธอ|
ไม่กล้าสบสายตา|
ทำให้ตัวเองดูงี่เง่า|
แปรงฟัน|
กังวลว่าหัวจะล้าน|
เข้าสู่จักรวาลคู่ขนาน|
พบชะตาชีวิตของตนเอง|
โดนคนแปลกหน้าทำร้าย|
พยากรณ์อนาคต|
นอนไม่หลับ|
เล่นซ่อนหา|
ยืม ผ้าเช็ดตัวโรงแรม|
ไปเยี่ยมคุณย่า|
หนีฝนตก|
พบขนขึ้นผิดที่|
มีความภาคภูมิใจอันแรงกล้า|
กลับสู่ความเป็นจริง|
กินคุกกี้ไหม้|
หลงผิดจนโงหัวไม่ขึ้น|
ทำไอติมหล่น|
โกนขนขา|
ได้รับการกอดอันยอดเยี่ยม|
ตีโฮมรันได้|
ขยี้แมลงประหลาด|
ฉีกจดหมายรัก|
ทำลายสถิติโลก|
โดนปล้นอัตลักษณ์ตัวตน|
อยู่โต้รุ่ง|
หนีการโดนจับ|
ได้รับจุมพิตแรก|
รู้สึกเสียใจกับอดีต|
ให้รางวัลตัวเอง|
เข่าถลอก|
ซื้อชุดสูทใหม่|
อารมณ์เสีย|
รู้สึกมั่นใจ|
ตกสำเภา|
หวังถึงสิ่งที่ดีที่สุด|
ไปสัก|
เรียนรู้สิ่งใหม่|
ดูทีวีทั้งคืน|
คิดว่าชีวิตมีครั้งเดียว|
จิ้มน้ำจิ้ม 2 ครั้ง|
ปวดหัวไมเกรนอย่างหนัก|
กำลังจะทนไม่ไหว|
ทำกุญแจบ้านหาย|
เข้าร่วมพิธีกรรมประหลาด|
พบนกสีฟ้าน่ารัก|
ร้องด้วยความยินดี|
ยอมทุกอย่างเพื่อความรัก|
หัวเราะจนร้องไห้|
อ่านหนังสือดีๆ|
วาดการ์ตูน|
คิดว่าตัวเองอาจตายได้|
ซื้อคอนโด|
เกือบจมน้ำ|
หวังว่าจะเล่นเปียโนเป็น|
ปราบปีศาจสุดชั่วร้าย|
ดื่มนมบูด|
รู้สึกแก่เป็นครั้งแรก|
แคะขี้มูก|
ซื้อวิกผม|
โดนล้วงกระเป๋า|
เข้าร่วมสมาคมลับ|
ดื่มด่ำไปกับซุปร้อน|
ซื้อลูกหมา|
หาส้วมไม่เจอ|
สาบานแก้แค้น|
หากระเป๋าตังค์ไม่เจอ|
เกือบชนะเลือกตั้ง|
ลืมว่าทำไมถึงโกรธ|
ได้กลิ่นอะไรเหม็นๆ|
เต็มไปด้วยความโศกเศร้า|
หยุดสะอึกไม่ได้|
เหยียบอะไรน่าขยะแขยง|
พับนกกระดาษ 1000 ตัว|
ร้องตะโกนเสียงดัง|
เชื่อในสัญชาตญาณ|
ถูกจับส่งโรงพยาบาล|
โดนน็อกเอาต์|
เริ่มก่อจลาจล|
รับผิดทุกข้อหา|
พบกับคู่ชีวิต|
หัวเราะกับช่วงเวลาสุดบัดซบ|
ชดใช้หนี้ชีวิต|
จับคนร้ายตัวจริงได้|
พยายามทำตัวให้ดูเท่|
ลืมว่ากำลังจะไปไหน|
ยัดปากกาเข้าจมูก|
ไม่ยอมจ่ายภาษีมูลค่าเพิ่ม|
ซื้อน้ำหอมราคาถูก|
เขม็งตาจนเสือหิวยังกลัว|
ชนะใจคนดู|
ตีลังกาอย่างสุดเท่|
ไม่ยอมให้เงินซื้อตัวได้|
เริ่มเขียนบล็อกโรงเรียนมัธยม|
ทำซอสบาร์บีคิวกินเอง|
โกรธจนเสียสติ|
เรอ|
เรียนการโยนลูกจั๊กกลิ้ง|
เข้าร่วมวงอะแคปเปลลา|
ร้องไห้น้ำตาหยดหนึ่ง|
ล้มโต๊ะ|
ไม่ยอมหยุดแคะขี้มูก|
ฟันหัก|
ชื่นชมสิ่งที่ปล้นมาได้|
น้ำลายไหลนิดนึง|
สู้กับฝูงโจรสลัด|
ฟื้นขึ้นมาจากความตาย|
เก็บแหวนแห่งพลังได้|
ทำสัญญากับพ่อมด|
เลิกกินกลูเตน|
ยอมพูดความจริง|
ได้รับเบอร์โทรศัพท์|
โดนเคจีบีไล่ล่า|
ดิ่งพสุธาอย่างปลอดภัย|
เล่นมุกตลก|
รู้สึกไม่ประทับใจ|
ชู้ต 3 แต้มได้|
ตีพิมพ์นิตยสาร|
ไล่ตีคนที่จุดเกิด|
เป่าลูกโป่งลูกใหญ่|
＠|