2098|Annihilated City
2099|The World Beyond
2100|To Battle! The Great Sweets War!
2101|開眼のチョコレート襲来！
2102|Unit-13 Strikes!
2103|高雄MRT レッドライン
2104|高雄MRT オレンジライン
2105|Shakurel Planet
2106|ドットヒーローズ
2107|Street Fighter (Easy)
2108|Street Fighter (Normal)
2109|Street Fighter (Hard)
2110|New Challenger
2111|New Challenger
2112|New Challenger
2113|New Challenger
2114|New Challenger
2115|New Challenger
2116|New Challenger
2117|New Challenger
2118|New Challenger
2119|New Challenger
2120|New Challenger
2121|New Challenger
2122|New Challenger
2123|New Challenger
2124|New Challenger
2125|７周年★東京スカイツリー
2126|Hatsune Miku
2127|MIKU EXPO
2128|MIKU CHERRY
2129|Manbosaki Strikes!
2130|MIKU EXPO
2131|MIKU CHERRY
2132|にゃんこ大泥棒
2133|U.F.O.襲来！
2134|Hatsune Miku's Birthday!
2135|Street Fighter (Easy)
2136|Street Fighter (Normal)
2137|Street Fighter (Hard)
2138|New Challenger
2139|New Challenger
2140|New Challenger
2141|New Challenger
2142|New Challenger
2143|New Challenger
2144|New Challenger
2145|New Challenger
2146|New Challenger
2147|New Challenger
2148|New Challenger
2149|New Challenger
2150|New Challenger
2151|New Challenger
2152|New Challenger
2153|New Challenger
2154|New Challenger
2155|New Challenger
2156|New Challenger
2157|New Challenger
2158|New Challenger
2159|New Challenger
2160|New Challenger
2161|New Challenger
2162|New Challenger
2163|SNOW MIKU
2164|Rumble in the Tendo Dojo
2165|The Cursed Springs
2166|Annihilated City
2167|Takuya & Yuki Awaken
2168|The Lost World
2169|City of Souls
2170|The World Beyond
2171|Godzilla: Final Assault
2172|Godzilla vs Cats
2173|Be a Magical Girl
2174|Be a Magical Girl II
2175|Witch's Labyrinth: Rose Garden Witch
2176|Witch's Labyrinth: Dessert Witch
2177|Witch's Labyrinth: Box Witch
2178|Nutcracker Witch
2179|秋華賞（ＧⅠ）
2180|菊花賞（ＧⅠ）
2181|天皇賞（秋）（ＧⅠ）
2182|有馬記念（ＧⅠ）
2183|高雄メトロ レッドライン
2184|高雄ライトレール
2185|協賛BitSummit記念！
2186|Battle! Tamakoma Second's Leader
2187|Battle! Tamakoma Second's Ace
2188|Vs Training Marmod
2189|New Challenger
2190|New Challenger
2191|New Challenger
2192|New Challenger
2193|Street Fighter: VERY HARD
2194|Holy War: Saber
2195|Holy War: Lancer
2196|Holy War: Archer
2197|Holy War: Rider
2198|Holy War: Gilgamesh
2199|救出！にゃんこ仮面ライダー
2200|救出！ゴジラにゃんこ
2201|救出！エヴァンゲリオンにゃんこ
2202|救出！ウルトラマンにゃんこ
2203|シン・にゃんこ・ヒーローズ
2204|Redhead Yuki Cat Awakens!
2205|The 9th Angel Strikes!
2206|The 10th Angel Strikes!
2207|Eva Unit-13 Strikes!
2208|Final Battle: Eva Unit-13
2209|Bye-bye, all of the Cats
2210|Weekend Concert: Day 1
2211|Weekend Concert: Day 2
2212|週末ライブ DAY1（韓国版専用）
2213|週末ライブ DAY2（韓国版専用）
2214|Era of Enoch
2215|Battle with Madhead!
2216|Rurouni Kenshin
2217|Kenshin Himura, Battosai
2218|Sanosuke Sagara, Fighter for Hire
2219|A Wolf Baring Fangs
2220|Witch's Labyrinth: Rose Garden Witch
2221|Witch's Labyrinth: Dessert Witch
2222|Witch's Labyrinth: Box Witch
2223|Strongest Things Alive
3000|จักรวรรดิแมวบทที่ 1
3001|จักรวรรดิแมวบทที่ 2
3002|จักรวรรดิแมวบทที่ 3
3003|สู่อนาคตบทที่ 1
3004|สู่อนาคตบทที่ 2
3005|สู่อนาคตบทที่ 3
3006|แมวแห่งห้วงอวกาศบทที่ 1
3007|แมวแห่งห้วงอวกาศบทที่ 2
3008|แมวแห่งห้วงอวกาศบทที่ 3
4000|進化素材ドロップEX
4001|進化素材ドロップEX
4002|進化素材ドロップEX
4003|進化素材ドロップEX
4004|進化素材ドロップEX
4005|弱り目に祟り目EX
4006|神判の日EX
4007|オーバーテクノロジーEX
4008|マタタビチャレンジEX
4009|マタタビチャレンジEX
4010|マタタビチャレンジEX
4011|マタタビチャレンジEX
4012|マタタビチャレンジEX
4013|マタタビチャレンジEX
4014|マタタビチャレンジEX
4015|マタタビチャレンジEX
4016|マタタビチャレンジEX
4017|マタタビチャレンジEX
4018|マタタビチャレンジEX
4019|マタタビチャレンジEX
4020|マタタビチャレンジEX
4021|狂乱のもねこ降臨EX
4022|進化の古代マタタビEX
4023|協賛BitSummit記念！EX
4024|協賛BitSummit記念！EX
4025|進化の虹マタタビEX
4026|太古の力EX
4027|終末ノ連戦場EX
4028|終末ノ連戦場EX
4029|終末ノ連戦場EX
4030|終末ノ連戦場EX
4031|終末ノ連戦場EX
4032|終末ノ連戦場EX
4033|終末ノ連戦場EX
4034|終末ノ連戦場EX
4035|終末ノ連戦場EX
4036|終末ノ連戦場EX
4037|終末ノ連戦場EX
4038|終末ノ連戦場EX
4039|天使と般若EX
4040|女帝と亡者EX
4041|伯爵と乙女EX
4042|富士山EX
4043|進化素材ドロップEX
4044|進化素材ドロップEX
4045|進化素材ドロップEX
4046|進化素材ドロップEX
4047|時の運EX(天国)
4048|時の運EX(地獄)
4049|進化素材ドロップEX
4050|進化素材ドロップEX
4051|修学旅行ステージEX
4052|亡者と河豚EX
4053|女帝と乙女EX
4054|伯爵と天使EX
4055|狂乱のもねこ降臨EX
4056|#02「13日は何曜日」EX
4057|お年玉襲来！EX
4058|お年玉襲来！EX(韓国版)
4059|進化素材ドロップEX
4060|狩人の地図ⅣEX
4061|熱血！リレー大会EX1
4062|熱血！リレー大会EX2
4063|第2章 ツボーン洞窟　EXステージ
4064|進化素材ドロップEX
4065|阿亀と赤子EX
4066|王子と死霊EX
4067|蜜江と聖者EX
4068|イディ第3進化マップ
4069|古代賢者マップ
4070|
4071|
4072|ความทรงจำแห่งปี 2024 สมรภูมิ 2
4073|ความทรงจำแห่งปี 2024 สมรภูมิ 3
6000|หอผู้เริ่มต้น
6001|ニコニコの間
7000|หอคอยสวรรค์
7001|ป้อมปราการสีแดง
7002|ป้อมปราการสีดำ
7003|ป้อมปราการเทพ
7004|ป้อมปราการเอเลี่ยน
7005|ป้อมปราการซอมบี้
7006|หอคอยนรก
7007|ป้อมปราการไร้คุณสมบัติ
7008|ป้อมปราการอากุ
7009|ป้อมปราการซากวัตถุ
7010|หอคอยทอง
11000|สังเวียนเกียรติยศ
11001|สังเวียนเกียรติยศ
11002|สังเวียนเกียรติยศ
11003|สังเวียนเกียรติยศ
11004|สังเวียนเกียรติยศ
11005|สังเวียนเกียรติยศ
11006|สังเวียนเกียรติยศ
11007|สังเวียนเกียรติยศ
11008|สังเวียนเกียรติยศ
11009|สังเวียนเกียรติยศ
11010|สังเวียนเกียรติยศ
11011|สังเวียนเกียรติยศ
11012|สังเวียนเกียรติยศ
11013|สังเวียนเกียรติยศ
11014|สังเวียนเกียรติยศ
11015|สังเวียนเกียรติยศ
11016|สังเวียนเกียรติยศ
11017|สังเวียนอำนาจ
11018|สังเวียนเกียรติยศ
11019|สังเวียนเกียรติยศ
11020|ตำนานเล่าขานเกียรติยศ
11021|ตำนานเล่าขานเกียรติยศ
11022|ตำนานเล่าขานเกียรติยศ
11023|สังเวียนเกียรติยศ
11024|สังเวียนเกียรติยศ
11025|สังเวียนเกียรติยศ
11026|สังเวียนอำนาจ
11027|Arena of Honor
11028|สังเวียนอำนาจ
11029|
11030|สังเวียนโชคชะตา
11031|Arena of Honor
12000|การต่อสู้ท้าทาย
13000|ตำนานบทใหม่
13001|มังกรปรากฏตัว
13002|ป่าไม่สิ้นสุด
13003|กระแสบรรพกาล
13004|อ่าวบาร์กิ้ง
13005|ผู้จ้องมองห้วงหุบเหว
13006|นีโอ-เนโครโปลิส
13007|กฎแห่งแดนเถื่อน
13008|คาบสมุทรพาราริล่า
13009|แมวกบฏ
13010|เกาะเชอร์รี่
13011|ห้วงลึกของใจฉัน
13012|ทะเลผี
13013|รีสอร์ทของผู้พลัดถิ่น
13014|ถนนแห่งการทรมาน
13015|ตรอกหลังของสวรรค์
13016|ศึกในอ่างน้ำ
13017|ภูเขาโบราณ
13018|กระทรวงทางทะเล
13019|โรงเรียนปีศาจ
13020|เหมืองเจลาติน
13021|โรงหล่อเมา
13022|วัตถุที่ยังไม่ได้ขุดขึ้นมา
13023|อาณาจักรกังวลทำไม
13024|ไทเทเนียมสูบ
13025|เกาะมอร์นิ่งสตาร์
13026|ในป่าหลับใหล
13027|เกาะทดลอง
13028|สุสานที่ถูกลืม
13029|รุ่งอรุณแห่งการเริ่มต้น
13030|วัดโชคดีมีสุข
13031|โรงละครแห่งความกลัว
13032|เมืองนักดำน้ำ
13033|นาซิโกแรง
13034|ไร่ดีเอ็นเอ
13035|เขาวงกตป่าโบราณ
13036|ปราสาททหารยาม
13037|การบิดเบือดเวลาอวกาศ
13038|หายนะที่ใกล้เข้ามา
13039|ไบคุระ ท่าเรือแห่งความชั่วร้าย
13040|ดินแดนร้อนถึงตาย
13041|ถนนสีกุหลาบ
13042|ยอดเขาเบฮีมอต
13043|ชายหาดบูดบึ้ง
13044|หมู่บ้านไล่ล่าแมว
13045|ตลาดของราชาโจรสลัด
13046|ระหว่างความจริงและคำโกหก
13047|มนุษยชาติกลายเป็นแมว
13048|ป่าศักดิ์สิทธิ์
14000|สีเหลืองเปล่งแสง
14001|สีฟ้าเปล่งแสง
14002|สีแดงเปล่งแสง
14003|สีม่วงเปล่งแสง
14004|สีเขียวเปล่งแสง
14005|เผชิญอันตราย
14006|การยึดครองของฮิปโป!
14007|โอกาสรับตั๋วแมว!
14008|XP ไร้ปรานี!
14009|XP ถล่มทลาย
14010|XP เมกะบลิตซ์!
14011|ด่าน XP
14012|ไคลโอเนลเถลิงอำนาจ
14013|แม่น้ำสติกซ์
14014|ราชาภิเษกราชินี
14015|ตายตั้งแต่เริ่ม
14016|การแก้แค้นของราชาวาห์วาห์
14017|กำลังฝันลึก
14018|หายนะแดงเลือด
14019|สวรรค์แห่งความมืด
14020|ไร้เพื่อน
14021|สวรรค์พิโรธ
14022|การเยาะเย้ยแสนหวาน
14023|มิติแห่งความสิ้นหวัง
14024|แมวคลั่ง
14025|รถถังคลั่ง
14026|ขวานคลั่ง
14027|ตัวน่ารังเกียจคลั่ง
14028|วัวคลั่ง
14029|นกคลั่ง
14030|ปลาคลั่ง
14031|กิ้งก่าคลั่ง
14032|ไททันคลั่ง
14033|แรงกระแทกสีฟ้า
14034|โมเนโกะคลั่ง
14035|ท้องฟ้าแดงยามเช้า
14036|วงล้อความตาย
14037|นีโม่ไต้ฝุ่น
14038|เจ้าปีศาจ
14039|ก้นปลักตม
14040|แมววิกลจริต
14041|รถถังวิกลจริต
14042|ขวานวิกลจริต
14043|ตัวน่ารังเกียจวิกลจริต
14044|วัววิกลจริต
14045|นกวิกลจริต
14046|ปลาวิกลจริต
14047|กิ้งก่าวิกลจริต
14048|ไททันวิกลจริต
14049|มิติที่ 2
14050|ขุมทรัพย์ XP!
14051|ชั่วเปล่งแสง
16000|เควสต์ตำนาน
20000|จักรวรรดิแมวบทที่ 1 (ซอมบี้)
20001|จักรวรรดิแมวบทที่ 2 (ซอมบี้)
20002|จักรวรรดิแมวบทที่ 3 (ซอมบี้)
21000|สู่อนาคตบทที่ 1 (ซอมบี้)
21001|สู่อนาคตบทที่ 2 (ซอมบี้)
21002|สู่อนาคตบทที่ 3 (ซอมบี้)
22000|แมวแห่งห้วงอวกาศบทที่ 1 (ซอมบี้)
22001|แมวแห่งห้วงอวกาศบทที่ 2 (ซอมบี้)
23000|แมวแห่งห้วงอวกาศบทที่ 3 (ฟิลิบัสเตอร์)
24000|แมวน้ำบารอนจู่โจม!
24001|แมวน้ำบารอนจู่โจม!!
24002|แมวน้ำบารอนจู่โจม!!!
24003|เลอ'กริมจู่โจม!
24004|เลอ'กริมจู่โจม!!
24005|เลอ'กริมจู่โจม!!!
24006|ภัยระดับเมกะ!
24007|ภัยระดับเมกะ!!
24008|ภัยระดับเมกะ!!!
24009|ฮิปโปสยองบุก!
24010|ฮิปโปสยองบุก!!
24011|ฮิปโปสยองบุก!!!
24012|ปีใหม่สุดอลังการ!
24013|วาเลนไทน์สุดอลังการ!
24014|ฤดูใบไม้ผลิสุดทนทุกข์!
24015|ด่านจู่โจมมิถุนายน
24016|ด่านจู่โจมมิถุนายน II
24017|ด่านจู่โจมกรกฎาคม
24018|ด่านจู่โจมกรกฎาคม II
24019|แมวพักฤดูร้อน
24020|แมวน้ำบารอนจู่โจม
24021|ด่านจู่โจมสิงหาคม
24022|ด่านจู่โจมสิงหาคม II
24023|ด่านจู่โจมกันยายน
24024|ด่านจู่โจมกันยายน II
24025|ด่านจู่โจมตุลาคม
24026|ด่านจู่โจมตุลาคม II
24027|เลอ'กริมจู่โจม
24028|ด่านจู่โจมพฤศจิกายน
24029|ด่านจู่โจมพฤศจิกายน II
24030|ด่านจู่โจมธันวาคม
24031|ด่านจู่โจมธันวาคม II
24032|ด่านจู่โจมมกราคม
24033|ด่านจู่โจมมกราคม II
24034|ภัยระดับเมกะ
24035|ฮิปโปสยองบุก
24036|ปีใหม่สุดอลังการ!
24037|ทูตสวรรค์ศักดิ์สิทธิ์จู่โจม
24038|บิ๊กเปงซีจู่โจม
24039|ด่านจู่โจมกุมภาพันธ์
24040|ด่านจู่โจมกุมภาพันธ์ II
24041|Festival Cats: Lunar New Year's
24042|ฝูงแมว
24043|ด่านจู่โจมมีนาคม
24044|ด่านจู่โจมมีนาคม II
24045|โจมตีของใจเหงา
24046|ด่านจู่โจมเมษายน
24047|ด่านจู่โจมเมษายน II
24048|ฤดูกาล 1: วันไปโรงเรียน
24049|รวมดาราอีเวนต์รายเดือน การรวมตัวแสดงความขอบคุณ
24050|ด่านจู่โจมพฤษภาคม
24051|ด่านจู่โจมพฤษภาคม II
24052|#01 โบสถ์ผี
24053|ภารกิจท้าทายด่านดวล
24054|ภารกิจท้าทายสังเวียนแท็ก
24055|เกาะแห่งสมบัติลับ
24056|#03 คืนท่องราตรีของปีศาจ
24057|ตอนที่ 1: ทศวรรษแห่งความทรงจำ
24058|คืนที่ 2: ส่งของขวัญคืนก่อนวันคริสต์มาส
24059|ปีใหม่สุดอลังการ!
24060|การบุกรุกของแมวแทงก์
24061|การโจมตีของลางร้าย
24062|第1章 ネコたちの冒険
24063|ปีใหม่สุดสุขสันต์!
24064|ฝูงแมว
24065|กิกะฮานิวานจู่โจม!
24066|わんわん王国の異変
24067|แมวพักฤดูร้อนติดเกาะ
24068|#01 ตื่นผี
24069|ปีใหม่สุดอลังการ!
24070|สมรภูมิต่อรอง
25000|ทุ่งไอทัม
25001|หุบเขาวิตามิน
25002|นักล่าตั๋ว
25003|พันธนาการวิญญาณ
25004|ถ้ำแห่งวิญญาณ
25005|เขาวงกตแห่งวิญญาณ
25006|ถ้ำเพชรตาแมว
25007|ภูเขาไฟวิตามิน
25008|นักล่าตั๋ว G
25009|ใจกลางแดง
25010|ยอดแดง
25011|ชายเขตแดง
25012|ใจกลางท้องฟ้า
25013|ยอดท้องฟ้า
25014|ชายเขตท้องฟ้า
25015|ใจกลางดำ
25016|ยอดดำ
25017|ชายเขตดำ
25018|ใจกลางศักดิ์สิทธิ์
25019|ยอดศักดิ์สิทธิ์
25020|ชายเขตศักดิ์สิทธิ์
25021|ใจกลางจักรวาล
25022|ยอดจักรวาล
25023|ชายเขตจักรวาล
25024|ใจกลางเนโคร
25025|ยอดเนโคร
25026|ชายเขตเนโคร
25027|ใจกลางเหล็กกล้า
25028|ยอดเหล็กกล้า
25029|ชายเขตเหล็กกล้า
25030|ที่ซ่อนซอมซ่อ
25031|ที่ซ่อนมีสไตล์
25032|ที่ซ่อนสมบูรณ์แบบ
25033|ใจกลางแดง
25034|ยอดแดง
25035|ชายเขตแดง
25036|ใจกลางท้องฟ้า
25037|ยอดท้องฟ้า
25038|ชายเขตท้องฟ้า
25039|ใจกลางดำ
25040|ยอดดำ
25041|ชายเขตดำ
25042|ใจกลางศักดิ์สิทธิ์
25043|ยอดศักดิ์สิทธิ์
25044|ชายเขตศักดิ์สิทธิ์
25045|ใจกลางเนโคร
25046|ยอดเนโคร
25047|ชายเขตเนโคร
25048|ใจกลางจักรวาล
25049|ยอดจักรวาล
25050|ชายเขตจักรวาล
25051|ที่ซ่อนซอมซ่อ
25052|ที่ซ่อนซอมซ่อ
25053|ที่ซ่อนซอมซ่อ
25054|ที่ซ่อนมีสไตล์
25055|ที่ซ่อนมีสไตล์
25056|ที่ซ่อนมีสไตล์
25057|ที่ซ่อนสมบูรณ์แบบ
25058|ที่ซ่อนสมบูรณ์แบบ
25059|ที่ซ่อนสมบูรณ์แบบ
25060|แผนที่นักล่า I
25061|แผนที่นักล่า II
25062|แผนที่นักล่า III
25063|กำเนิดสัญชาตญาณร้าย
25064|ปลายยอดสัญชาตญาณร้าย
25065|ที่หลบภัยสัญชาตญาณร้าย
25066|แผนที่นักล่า IV
25067|ใจกลางซากวัตถุ
25068|ยอดซากวัตถุ
25069|ชายเขตซากวัตถุ
27000|Messier's Assault
27001|U.F.O.軍団 強襲！
27002|The Devils Strike!
27003|The Angels Strike!
27004|Trials of Merc Storia!
27005|Electric Diva Strikes!
27006|強襲！電子の歌姫(韓国版)
27007|Heralds of The End
27008|Test of Might: Ranma 1/2
27009|Walpurgisnacht
27010|めざせＧＩ にゃんこ競馬
27011|強襲！城とドラゴン
27012|Test of Might: "Ranma 1/2"
27013|Manbosaki Strikes!
27014|Gauntlet of Servants
27015|METAL SLUG STRIKES!
27016|Ascend the Tower of Saviors
27017|Aoshi Shinomori Strikes!
27018|Vs Kaoru Hanayama
27019|Vs Katsumi Orochi
27020|Vs Retsu Kaioh
27021|Vs Jack Hammer
27022|Vs Baki Hanma
30000|ดินแดนอากุ
31000|ป่าลับแห่งกาปร้า
31001|ทะเลทรายแอชวินี
31002|ภูเขาไฟจินโฟร์
33000|เขาวงกตใต้ดิน: เหวลึกขนาดใหญ่
34000|ทุ่งศูนย์
34001|ขอบแห่งกาลอวกาศ
34002|แอ่งลุ่มน้ำแมว
34003|บันทึกอุรุรุบุ
34004|พื้นที่โลกใหม่: อีเฮน
34005|แมวแห่งท้องทะเลหลวง
34006|ความจริงสุดโต่ง
34007|ปีศาจแห่งอ่าวเดซิลิตร
34008|สวนแห่งความคิดห่อเหี่ยว
34009|เส้นทางสตราโตสเฟียร์
34010|หุบเขาบุก
34011|สวรรค์แคนดี้
34012|เกาะคาวี่โดดเดี่ยว
34013|รีสอร์ทเดอลาคอสป้า
34014|เขตหวงห้าม
34015|แพนิกบนเรือสำราญ
34016|ศาลเจ้าอองการ์ด
34017|ป่าสนามเด็กเล่น
34018|ร่องนิวทาวน์
36000|โคลอสเซียมนอกโลก
36001|โคลอสเซียมนอกโลก
36002|โคลอสเซียมนอกโลก
36003|โคลอสเซียมนอกโลก
36004|โคลอสเซียมนอกโลก
36005|โคลอสเซียมนอกโลก
36006|โคลอสเซียมนอกโลก
36007|โคลอสเซียมนอกโลก
36008|โคลอสเซียมนอกโลก
36009|โคลอสเซียมนอกโลก
36010|โคลอสเซียมนอกโลก
37000|กรงเล็บแมวแชมเปี้ยนชิปขั้นที่ 1
37001|กรงเล็บแมวแชมเปี้ยนชิปขั้นที่ 2
37002|กรงเล็บแมวแชมเปี้ยนชิปขั้นที่ 3
37003|กรงเล็บแมวแชมเปี้ยนชิปขั้นที่ 4
37004|กรงเล็บแมวแชมเปี้ยนชิปขั้นที่ 5
37005|กรงเล็บแมวแชมเปี้ยนชิปขั้นที่ 6
37006|กรงเล็บแมวแชมเปี้ยนชิปขั้นที่ 7
37007|กรงเล็บแมวแชมเปี้ยนชิปขั้นที่ 8
37008|กรงเล็บแมวแชมเปี้ยนชิปขั้นที่ 9
37009|กรงเล็บแมวแชมเปี้ยนชิปขั้นที่ 10
37010|กรงเล็บแมวแชมเปี้ยนชิปขั้นที่ 11
37011|กรงเล็บแมวแชมเปี้ยนชิปขั้นที่ 12