0|ตำนานเริ่มขึ้นแล้ว
1|ดินแดนความหลงใหล
2|ทะเลกลูโคซามีน
3|แมวว่ายน้ำ
4|ผืนดินสุ่มเสี่ยง
5|ถนนตะวันตก
6|ทะเลแห่งทูน่า
7|เกาะไม้ไผ่
8|ถ้ำยวบยาบ
9|ภูเขาไฟโวลเคโนส
10|เรื่องแมวๆ ไม่มีวันจบ
11|ปราสาทปลา
12|เกาะซูชิ
13|เสาเกาเล็บ
14|วิหารพาร์เธนอน
15|ชายหาดคลื่นต่ำ
16|คุกอัลคาทราซ
17|อุโมงค์แหกคุก
18|คุกคาโปน
19|เส้นทางสายไหม
20|บันไดสู่ความมืด
21|เจ้าชายแห่งความมืด
22|คืนแห่งทางตัน
23|แบตเทิลรอยัล
24|แผลเป็นแห่งสงคราม
25|มลพิษทะเล
26|กายและจิตวิญญาณ
27|อ่อนแอและเป็นกรดเล็กน้อย
28|แมวใจกล้า
29|มหานครเงามืด
30|กาลาปา-ก็อธ
31|แหลมคอมบู
32|แกนแห่งความชั่วร้าย
33|เขตชานแห่งความตาย
34|หมู่เกาะกักกัน
35|เมาซี่แลนด์
36|ทางเดินแห่งชื่อเสียง
37|ชายฝั่งหัวขโมย
38|บนและล่าง
39|เกาะไร้ลม
40|สุสานใต้ดิน IT
41|แกลลอรี่พิสดาร
42|เขต 22
43|เหนือทุ่งสะวันนา
44|ถนนพายุหิมะ
45|ซิงกูลาริตี้วิลล์
46|จุดจบของโลก
47|ตำนานสิ้นสุด
48|ห้องทดลองซากวัตถุ
1000|ด่านวันจันทร์
1001|ด่านวันอังคาร
1002|ด่านวันพุธ
1003|ด่านวันพฤหัสบดี
1004|ด่านวันศุกร์
1005|ด่านสุดสัปดาห์
1006|โอกาสรับตั๋วแมว!
1007|การยึดครองของฮิปโป!
1008|ฤดูใบไม้ร่วง = วันแข่งกีฬา
1009|แรงงานด้วยความรัก
1010|กระดิ่งแมวจิงเกิ้ล
1011|สุขสันต์วันปีใหม่?
1012|ความสุขตามพิธี
1013|หมีเปลือยเปล่า
1014|หายนะแดงเลือด
1015|สวรรค์แห่งความมืด
1016|ไร้เพื่อน
1017|แมวคลั่ง
1018|รถถังคลั่ง
1019|ขวานคลั่ง
1020|ตัวน่ารังเกียจคลั่ง
1021|วัวคลั่ง
1022|นกคลั่ง
1023|ปลาคลั่ง
1024|กิ้งก่าคลั่ง
1025|ไททันคลั่ง
1026|ครู! ฤดูใบไม้ผลิแล้ว!
1027|ด่านสุดสัปดาห์
1028|ด่าน XP
1029|รักคือความป่วย
1030|เจ้าสาวต้องห้าม
1031|ไม่เคยฤดูร้อน!
1032|แขกบ้านภูตผี
1033|การเฉลิมฉลองพิเศษ รวมดาราอีเวนต์รายเดือน!
1034|การเฉลิมฉลองอัลตร้า รวมดาราอีเวนต์รายเดือน!
1035|การเฉลิมฉลองอัศจรรย์ รวมดาราอีเวนต์รายเดือน!
1036|ชายแก่เจนโลก
1037|韓国版☆特別ステージ
1038|ฤดูใบไม้ร่วง = วันแข่งกีฬา!
1039|สวรรค์พิโรธ
1040|สุขสันต์วันเกิด! ครั้งที่ 1
1041|สุขสันต์วันเกิด! ครั้งที่ 2
1042|สุขสันต์วันเกิด! ครั้งที่ 3
1043|การเยาะเย้ยแสนหวาน
1044|เธอนั่นแหละ!
1045|นักแสดงหญิงตื่นขึ้น!
1046|กังฟูตื่นขึ้น!
1047|มิสเตอร์ตื่นขึ้น!
1048|พันธนาการตื่นขึ้น!
1049|ดอมตื่นขึ้น!
1050|แมวกล่องตื่นขึ้น!
1051|กางเกงในตื่นขึ้น!
1052|จักรยานสามล้อตื่นขึ้น!
1053|นินจาตื่นขึ้น!
1054|ซอมบี้ตื่นขึ้น!
1055|ซามูไรตื่นขึ้น!
1056|ซูโม่ตื่นขึ้น!
1057|บูกี้ตื่นขึ้น!
1058|กระโปรงตื่นขึ้น!
1059|XP เมกะบลิตซ์!
1060|ความเศร้าแสนหวาน
1061|ลงสู่ความมืด
1062|ลงสู่ความมืด II
1063|ลงสู่ความมืด III
1064|ลงสู่ความมืด ∞
1065|แมวศึกป๊อป!
1066|มิติแห่งความสิ้นหวัง
1067|TWその１
1068|20 Mil Downloads Special Gift!
1069|คาร์นิวัลชะตาขาด
1070|การเฉลิมฉลองสุดวิเศษ รวมดาราอีเวนต์รายเดือน!
1071|Minced Meet-Up
1072|ถนนฮาโลวีน!
1073|ด่านบลิตซ์จันทร์
1074|ด่านบลิตซ์อังคาร
1075|ด่านบลิตซ์พุธ
1076|ด่านบลิตซ์พฤหัส
1077|ด่านบลิตซ์ศุกร์
1078|เผชิญอันตราย
1079|การเฉลิมฉลองยอดเยี่ยม รวมดาราอีเวนต์!
1080|ของขวัญวันเกิด!
1081|เซนต์นิกสุขสันต์
1082|ออลด์แลงไซน์!
1083|แมวผู้ใหญ่ตื่นแล้ว!
1084|แมวชั่วร้ายตื่นแล้ว!
1085|แมวตุ๊กตาตื่นแล้ว!
1086|หญิงสาวตื่นแล้ว!
1087|ปลาคาร์ฟตื่นขึ้น!
1088|เจ้าสาวตื่นขึ้น!
1089|วันหยุดพักผ่อนตื่นขึ้น!
1090|การล้างแค้นตื่นแล้ว!
1091|กังฟู X ตื่นแล้ว!
1092|วันแข่งกีฬาตื่นขึ้น!
1093|มนุษย์เงินเดือนตื่นแล้ว!
1094|ปลาเรนเดียร์ตื่นขึ้น!
1095|ไคลโอเนลเถลิงอำนาจ
1096|ท้องฟ้าแดงยามเช้า
1097|สีเขียวเปล่งแสง
1098|สีม่วงเปล่งแสง
1099|สีแดงเปล่งแสง
1100|สีฟ้าเปล่งแสง
1101|สีเหลืองเปล่งแสง
1102|แมววิกลจริต
1103|รถถังวิกลจริต
1104|ขวานวิกลจริต
1105|ตัวน่ารังเกียจวิกลจริต
1106|วัววิกลจริต
1107|นกวิกลจริต
1108|ปลาวิกลจริต
1109|กิ้งก่าวิกลจริต
1110|ไททันวิกลจริต
1111|เลวสู่เลวยิ่งกว่า
1112|วันตัดสิน
1113|協賛BitSummit記念！
1114|เทคนูโรซิส
1115|ไดอารี่ฤดูร้อน
1116|แพ็กเกจปริศนา
1117|แม่น้ำสติกซ์
1118|บุฟเฟ่ต์ผลไม้เหมียว
1119|ราชาภิเษกราชินี
1120|คาร์นิวัลชะตาขาด II
1121|เทศกาลวัฒนธรรม
1122|วงล้อความตาย
1123|ของขวัญวันเกิด!
1124|XP ถล่มทลาย
1125|แมวในหิมะ
1126|เธอนั่นแหละ!
1127|วันของแมว
1128|ตายตั้งแต่เริ่ม
1129|กระเด้ง กระดึ๋ง กระดอน
1130|แมวน้อยตื่นขึ้น!
1131|รถถังน้อยตื่นขึ้น!
1132|ขวานน้อยตื่นขึ้น!
1133|ตัวน่ารังเกียจน้อยตื่นขึ้น!
1134|วัวน้อยตื่นขึ้น!
1135|นกน้อยตื่นขึ้น!
1136|ปลาน้อยตื่นขึ้น!
1137|กิ้งก่าน้อยตื่นขึ้น!
1138|ไททันน้อยตื่นขึ้น!
1139|สำหรับแฟนๆ
1140|มือทอง
1141|協賛BitSummit記念！
1142|ลื่นไหลสู่ชัยชนะ
1143|แมวคาร์ตตื่นขึ้น!
1144|開眼のネコンドー襲来！
1145|30M Celebration Gifts Galore!
1146|การเฉลิมฉลองจูบิลี่ยิ่งใหญ่ รวมดาราอีเวนต์!
1147|ดูและได้
1148|แมวดอกไม้ตื่นขึ้น!
1149|บทเรียนฤดูร้อน
1150|ถ้ำดาวตก
1151|เกาะเถ้ากระดูก
1152|สยายปีก
1153|แมวเบอร์เกอร์ตื่นขึ้น!
1154|สัปดาห์เงิน
1155|XP ไร้ปรานี!
1156|ของขวัญวันเกิด!
1157|มิติที่ 2
1158|การแก้แค้นของราชาวาห์วาห์
1159|เธอนั่นแหละ!
1160|บัณฑิตสู้ๆ!
1161|โมเนโกะคลั่ง
1162|อาวุโสเปล่งแสงๆ
1163|協賛BitSummit記念！
1164|ลื่นไหลสู่ชัยชนะ
1165|เจ้าสาวต้องห้ามตอน II
1166|ไม่เคยไม่ใช่ฤดูร้อน
1167|คนแปลกหน้าภูตผี
1168|ชายแก่ในเมือง
1169|การล้างแค้นแดงเลือด
1170|คืนแข่งกีฬา
1171|ปฏิวัติของกรรมกร
1172|สวรรค์แห่งความมืด NEO
1173|การล้างแค้นของไซแบร์
1174|เทศกาลวัฒนธรรม
1175|คริสต์มาสในอวกาศ
1176|ไม่มีเพื่อนเหมือนกัน
1177|กำลังฝันลึก
1178|เดือดดาล
1179|เดือดดาล II
1180|เดือดดาล III
1181|เดือดดาล ∞
1182|สุดยอดของขวัญ DX รวมดาราอีเวนต์
1183|ของขวัญวันเกิด
1184|ปีใหม่อีกครั้ง
1185|สิ่งศักดิ์สิทธิ์พิโรธ
1186|ความสับสนตามพิธี
1187|การเยาะเย้ยขื่นขม
1188|เธอนั่นแหละ!
1189|นีโม่ไต้ฝุ่น
1190|คาร์นิวัลชะตาขาด III
1191|มหกรรมของขวัญ ฉลอง 40 ล้าน!
1192|หมีกลับมา
1193|มิติแห่งความเพ้อคลั่ง
1194|ใบไม้ผลิสำหรับเซ็นเซ
1195|ท้องฟ้าแดงยามค่ำคืน
1196|ไคลโอเนลเรืองอำนาจ
1197|ป่วยรักอีกครั้ง
1198|ความตายมาไม่หยุด
1199|แม่น้ำอะเครอน
1200|にゃんこグミ大戦争
1201|การประณามของราชินี
1202|協賛BitSummit記念！
1203|มิติที่ 3
1204|แพ็กเกจปริศนา
1205|ตายด้วยการตายอีกครั้ง
1206|แมวศึกผนึกกำลัง!
1207|การกลับมาของราชาวาห์วาห์
1208|เผ่าวิกลจริต
1209|วันเหมียวๆ
1210|ดวลที่ทุ่งหญ้า
1211|ดวลยามอัสดง
1212|ดวลใต้ดวงดาว
1213|ดวลที่สันทราย
1214|ฝันลึกยิ่งขึ้น
1215|แรงกระแทกสีฟ้า
1216|ของขวัญวันเกิด
1217|ราชสำนักแห่งการทรมาน
1218|謎の宅配便
1219|สวรรค์ของปาปู
1220|ราชินีชรา
1221|เธอนั่นแหละ!
1222|เอปิกเปล่งแสง
1223|พ่ายแพ้มากที่สุด 2019
1224|ตรุษจีน
1225|แพ็กเกจปริศนา
1226|ก้นปลักตม
1227|ดวลที่ทุ่งลาวา
1228|50M Celebration Gifts Galore!
1229|ความยิ่งใหญ่ของวานวาน
1230|ของขวัญวันเกิด
1231|ซีโอเนลผงาด!
1232|ธุระครั้งแรก
1233|เกาะของเจ้าแห่งแผนที่
1234|สงครามเต็มสูบ: พิเศษฤดูใบไม้ผลิ
1235|สงครามเต็มสูบ: พิเศษฤดูร้อน
1236|สงครามเต็มสูบ: พิเศษฤดูใบไม้ร่วง
1237|สงครามเต็มสูบ: พิเศษฤดูหนาว
1238|สังเวียนแท็ก: มือใหม่
1239|สังเวียนแท็ก: ผู้เริ่มต้น
1240|สังเวียนแท็ก: สันทัด
1241|สังเวียนแท็ก: มือโปร
1242|สังเวียนแท็ก: เชี่ยวชาญ
1243|ที่หนึ่งของห้วยบึง
1244|ของขวัญวันเกิด
1245|ปรากฏมากที่สุด 2020
1246|โหมโรงสู่ความพินาศ
1247|ไต้ฝุ่นนิฮิล
1248|ดวลใต้ทะเล
1249|ネコウエハース降臨
1250|สนามพิสูจน์ฝีมือ
1251|เทพและปีศาจ
1252|ราชินีและภูตผี
1253|ราชาและหญิงสาว
1254|มหกรรมของขวัญ ฉลอง 60 ล้าน!
1255|แหล่งรวมความลี้ลับ
1256|ผู้รับใช้แห่งความมืด
1257|แมวชั่วร้าย
1258|รถถังชั่วร้าย
1259|เจ้าปีศาจ
1260|บอลกลิ้งเลือดร้อน
1261|คอร์สท้าทายเลือดร้อน
1262|การแข่งสามขาเลือดร้อน ①
1263|การแข่งสามขาเลือดร้อน ②
1264|การแข่งสามขาเลือดร้อน ③
1265|สวนปีศาจ
1266|ขวานชั่วร้าย
1267|韓国版専用お年玉襲来！
1268|ปลดปล่อยแมว
1269|รายงานจักรพรรดินี 1
1270|รายงานจักรพรรดินี 2
1271|รายงานจักรพรรดินี 3
1272|ซิมโฟนีแห่งความดึงดูดใจ
1273|ราโชมอน
1274|ชั่วเปล่งแสง
1275|รายงานจักรพรรดินี 4
1276|รายงานจักรพรรดินี 5
1277|การขุดของจักรพรรดินี 1
1278|การขุดของจักรพรรดินี 2
1279|การขุดของจักรพรรดินี 3
1280|การขุดของจักรพรรดินี 4
1281|การขุดของจักรพรรดินี 5
1282|ข้อ 1. ควิซอะไรอยู่ในกล่อง?
1283|ข้อ 5. ควิซแล้วแต่ดวง
1284|ของขวัญวันเกิด
1285|ศัตรูที่เห็นบ่อยที่สุด 5 อันดับแรก, 2021!
1286|วิบวับปีใหม่
1287|ที่ปกคลุมแห่งความมืด
1288|春節ハッピープレゼント！
1289|ขบวนเปลวเพลิง
1290|จากรุ่นน้องของคุณ
1291|จากรุ่นพี่ของคุณ
1292|จากเพื่อนวัยเด็ก
1293|中秋節ハッピープレゼント！
1294|ダミー
1295|ダミー
1296|ราชสำนักแห่งความทรมาน
1297|สงครามชิงวาเลนไทน์
1298|ฤดูกาล 2: เทศกาลจังหวะหัวใจ
1299|ฤดูกาล 3: ทัศนศึกษา
1300|สุดสัปดาห์: คำสารภาพ
1301|สุดสัปดาห์: คำสารภาพ
1302|สุดสัปดาห์: คำสารภาพ
1303|ฤดูกาล 4: วันสำเร็จการศึกษา
1304|มหกรรมของขวัญ  ฉลอง 70 ล้าน!
1305|ภูติผีและบวมฉุ
1306|ราชินีและหญิงสาว
1307|ราชาและเทพ
1308|#03 ??? ที่ 13
1309|#04 หมู่บ้านโหยหวน
1310|ภารกิจท้าทายด่านดวล
1311|ภารกิจท้าทายสังเวียนแท็ก
1312|ความเจ็บปวดในป่า
1313|ความแปลกในทะเลทราย
1314|ภัยร้ายในภูเขาไฟ
1315|ซูโม่แมลงรอบคัดเลือก
1316|ซูโม่แมลงรอบก่อนรองชนะเลิศ
1317|ซูโม่แมลงรอบรองชนะเลิศ
1318|ซูโม่แมลงรอบชิงชนะเลิศ
1319|ขุมทรัพย์ XP!
1320|#02 ลดน้ำตาลไม่ได้
1321|#04 แผนเจ้าเล่ห์
1322|ตอนที่ 2: กลอุบายศัตรู
1323|ตอนที่ 5: พาเหรดดนตรี
1324|ของขวัญวันเกิด
1325|คืนที่ 1: กรงเล็บซานต้าทำงาน
1326|ขุดเหมืองเอปิก
1327|เบื่อหน้าท็อป 5 ปี 2022!
1328|ฉลอง 80 ล้านดาวน์โหลด ของขวัญความสุข
1329|หลังเรื่อง ~วันสำเร็จการศึกษา~
1330|สุดสัปดาห์ ~อีกหนึ่งคำสารภาพ~
1331|สุดสัปดาห์ ~อีกหนึ่งคำสารภาพ~
1332|สุดสัปดาห์ ~อีกหนึ่งคำสารภาพ~
1333|ความเจ็บปวดในป่า II
1334|ความแปลกในทะเลทราย II
1335|ภัยร้ายในภูเขาไฟ II
1336|ซอมบี้ประจำบ้าน
1337|ปลุกพลังแมวไข่สี!
1338|ความยิ่งใหญ่ของนีโอวานวาน
1339|บททดสอบแมวเล็ก
1340|ยุคของทรราชย์
1341|ของขวัญวันเกิด!
1342|สุดยอดเจ้าปีศาจ
1343|#02 ช่อดอกไม้แห่งความหวาดกลัว
1344|การบ้านสิ้นสุดฤดูร้อน
1345|ความเจ็บปวดในป่า III
1346|ความแปลกในทะเลทราย III
1347|ภัยร้ายในภูเขาไฟ III
1348|เชื้อสายองครักษ์หนองน้ำซานซู
1349|เครื่องจักรลุกฮือ
1350|แมวใจชั่ว
1351|แทงก์ใจชั่ว
1352|ขวานใจชั่ว
1353|อี๋ใจชั่ว
1354|วัวใจชั่ว
1355|นกใจชั่ว
1356|ปลาใจชั่ว
1357|กิ้งก่าใจชั่ว
1358|ไททันใจชั่ว
1359|วิ่งผลัดริเวอร์ซิตี้
1360|第2章 ツボ洞窟の死闘
1361|第5章 わんわん城の戦い
1362|最終章 決戦！わんわん大王
1363|ของขวัญวันเกิด!
1364|คืนที่ 3: ส่งของขวัญวันก่อนคริสต์มาสอีก
1365|ศัตรูที่เห็นบ่อยที่สุด 5 อันดับแรกในปี 2023!
1366|โฮ่งหิมะ
1367|เทศกาลลดราคาตรุษจีน
1368|ฉลอง 90 ล้าน ของขวัญเพียบ!
1369|厄災のわんわん王国
1370|ของขวัญวันเกิด!
1371|แพ็กเกจปริศนา
1372|ฮันนีมูนสุดสัปดาห์ #1
1373|ฮันนีมูนสุดสัปดาห์ #2
1374|ฮันนีมูนสุดสัปดาห์: สุดท้าย
1375|ธุระครั้งแรก NEO
1376|ครอบครัวซูเปอร์สแมช
1377|เต่ากับเด็ก
1378|เจ้าชายกับผู้หวนคืน
1379|ราชินีกับนักบวช
1380|คืนแห่งฤดูร้อน มุ่งหน้ากลับบ้าน
1381|ความย้อนแย้งของปาปู
1382|เอาตัวรอดในป่า
1383|ราชินีอาวุโสสุด
1384|แมวหาบเร่ตื่นแล้ว!
1385|
1386|
1387|
1388|
1389|
1390|
1391|ล่าซีโนบีสต์
1392|ความทรงจำแห่งปี 2024
1393|ซีโอเนลฟื้นชีพ!
1394|บททดสอบแมววาลคีรี
1395|บททดสอบแมวบาฮามุต
1396|มหกรรมของขวัญฉลอง 100 ล้าน!
1397|
1398|
1399|
1400|
1401|
1402|รางวัลลูกค้า
1403|
2000|ふるさと自衛隊
2001|Alluring Princess
2002|Princess Punt
2003|To the Future
2004|拡散性ミリオンアーサー
2005|ドラゴンポーカー
2006|Final Boss Strikes?!
2007|Merc Storia: Inferno
2008|Merc Storia: Showdown
2009|ドラゴンリーグ
2010|超激突！氣志團！！
2011|Survive! Mola Mola!
2012|Droid Awakes!
2013|消滅都市 ～第１章～(旧)
2014|消滅都市 ～第２章～(旧)
2015|消滅都市 ～第３章～(旧)
2016|極道大戦争
2017|逆襲のメルクストーリア(旧)
2018|Healer Awakens!
2019|モンハン大狩猟クエスト
2020|【緊急】モンハン大狩猟クエスト
2021|Metal Slug Defense
2022|Super Metal Slug Defense
2023|神略！ゆるドラシル
2024|城とドラゴン
2025|開眼の城とドラゴン
2026|難攻不落の城とドラゴン
2027|まもるよネコさん
2028|Takuya & Yuki Awaken
2029|A Fungal Challenge
2030|ふてたネコあらわる
2031|Puella Magi Madoka Magica
2032|Witch's Labyrinth
2033|Witch's Labyrinth
2034|Witch's Labyrinth
2035|Walpurgisnacht
2036|突撃！キャットバスターズ
2037|Cabaret Cat Awakens!
2038|PIKOTARO
2039|TWその２
2040|ナゾのウサギ登場!?
2041|Gates of ALICE
2042|Moonlit City
2043|Princess Punt Awakens!
2044|Sleeping Beauty Punt Awakens!
2045|The Lost World
2046|Merc Awakens!
2047|Titi Awakens!
2048|神秘のメルクストーリア(旧)
2049|ぐでぐでしてます
2050|どうせ食べられるだけだし
2051|ＴＷその３
2052|The Holy Grail War
2053|Holy War: Saber
2054|Holy War: Lancer
2055|Holy War: Archer
2056|Holy War: Rider
2057|Holy War: Gilgamesh
2058|Sophomore Summer
2059|Prof. Wild's Challenge
2060|Date Chance: Karin
2061|Date Chance: Misaki
2062|Date Chance: Sairi
2063|Date Chance: Ren
2064|Mentori's Masterplan
2065|Evangelion Activates!
2066|Decisive Battle!
2067|The 9th Angel Strikes!
2068|The 10th Angel Strikes!
2069|Poko Forest Friends!
2070|Trio from the Woods
2071|太秦萌の通学
2072|松賀咲の通学
2073|小野ミサの通学
2074|地下鉄に乗るっ
2075|City of Souls
2076|ぐでぐでしてて忙しい
2077|開眼のぐでたまにゃんこ襲来！
2078|城ドラ VS 城ドラ
2079|Groove Like A Bear
2080|Teachings of the Kicking Kingdom
2081|A Fake Mitakihara
2082|Queen Rampant
2083|ヒカキン降臨
2084|開眼のヒカキン襲来！
2085|Merc Storia: Attack
2086|Merc Storia: Mystery
2087|Holy War: Saber Alter
2088|Survive! Mola Mola!
2089|300 Million Dead Molas
2090|開眼の三原慧悟襲来
2091|Majimeowと一緒に台湾を巡ろう！
2092|Spirit War
2093|Bikkuriman Choco
2094|Devilish Illusion
2095|Yamato Awakens!
2096|ゆる～い！ねこ娘襲来！
2097|ゆる～いゲゲゲの鬼太郎
