s’est fait capturer |		//ガマトト探検ログ表示：述語（ランダム生成）
a découvert une cité perdue |
a mangé à même le sol |
a perdu le fil de ses pensées |
s’est fait tabasser |
a construit la maison de ses rêves |
a manqué de souffle |
a sombré dans la folie |
a affronté sa plus grande peur |
a attrapé une maladie incurable |
s’est fait rejeter |
a suivi sa vraie passion |
a ramassé des fleurs |
a dû se gratter |
a fêté son anniversaire |
s’est fait tripoter |
a acheté des bonbons |
a fait un discours marquant |
a dû aller aux toilettes |
a joué au golf avec le patron |
a explosé |
a accepté un nouvel emploi |
a appris son adoption |
a acheté une assurance vie |
s’est fait écraser |
n’a plus rien supporté |
a dîné au calme en famille |
a pris son envol |
a ri très fort |
a tout misé sur un pari |
a fait un mauvais investissement |
a pleuré de rire |
a été timide |
a voulu aller au Canada |
a brisé un serment |
a fait un procès |
a pris une drôle de photo |
a rencontré son vrai père |
a impressionné son idole de jeunesse |
a failli mourir de honte |
a pris une nouvelle identité |
s’est fait arrêter |
a ressenti du soulagement |
a inspiré un dessin animé |
s’est fait exiler |
a fait un rapport à la police |
a dû aller au commissariat |
a vraiment tout raté |
s’est fait assigner à résidence |
a appris le sens de la vie |
a carrément perdu la tête |
a pété les plombs |
a fait faillite |
a chuté de son lit |
a mangé le meilleur des burgers |
a fait une superbe roue |
a trop bu |
a eu une illumination |
a maîtrisé la roulade |
a fondé une association |
s’est fait accuser de braconnage |
a résisté à son arrestation |
a ressenti de la nostalgie |
s’est fait de sacrés abdos |
a dû relever un défi en duel |
s’est fait mordre par une souris |
a eu très faim |
a vu quelque chose de louche |
a pleuré très fort |
n’a pas bu avec modération |
a révélé une conspiration |
a mangé salement |
a tremblé de peur |
a compris l’horreur de la guerre |
a commencé une nouvelle vie |
a roupillé quelques minutes |
a répété la question |
a vu un fantôme effrayant |
a pensé aux plats de sa mère |
a choisi le végétarisme |
a pesé sur une décision |
a ébruité un scandale |
a trouvé l’amour |
a mis une vraie pagaille |
a dansé jusqu’à l’aube |
a transpiré |
a terminé sa dissertation |
n’a mangé que du chou |
a combattu pour la paix |
a connu un chagrin d’amour |
s’est brûlé la langue |
a baillé |
a perdu son chemin |
s’est fait espionner |
a jeté de vieux slips |
a fait semblant de travailler |
a marmonné |
a perdu conscience |
a failli s’étouffer |
a repris ses esprits |
a acheté trop de donuts |
a nourri des canards |
a volé des bonbons à un bébé |
a soupçonné son meilleur ami |
a joué les geeks |
a volé un stylo |
a subi une intoxication |
a très mal vécu ce moment |
a travaillé à mi-temps |
a pris un jour de congé |
a découvert un sombre secret |
a assisté à une conférence |
a joué les divinités |
a envoyé le mauvais texto |
a évité tout contact visuel |
a été ridicule |
s’est brossé les dents |
a eu peur de la calvitie |
a visité un univers parallèle |
a compris son destin |
a rencontré un étranger |
a prédit le futur |
n’a pas pu dormir |
a joué à cache-cache |
a volé une serviette d’hôtel |
a rendu visite à sa mamie |
a évité une averse |
a crevé un abcès bizarre |
a ressenti de la fierté |
est sorti de son délire |
a mangé un biscuit brûlé |
s’est fait des idées |
a fait tomber sa crème glacée |
s’est rasé les jambes |
a gagné un gros câlin |
a marqué un pénalty |
a écrasé un drôle d’insecte |
a déchiré une lettre d’amour |
a battu un record du monde |
s’est fait voler son identité |
n’a pas dormi de la nuit |
a échappé à la captivité |
a reçu son premier baiser |
a regretté sa jeunesse gâchée |
s’est fait plaisir |
a écorché son genou |
a acheté une nouvelle tenue |
a perdu le contrôle |
a pris confiance |
a vécu un naufrage |
a espéré le meilleur |
s’est fait tatouer |
a appris quelque chose |
a regardé la TV toute la nuit |
a voulu profiter de la vie |
a joué sur les deux tableaux |
a eu une affreuse migraine |
en a vraiment eu assez |
a perdu ses clés |
a participé à un étrange rituel |
a trouvé un bel oiseau bleu |
a couiné de joie |
a tout abandonné par amour |
a ri jusqu’à en pleurer |
a lu un super livre |
a dessiné une BD |
a cru mourir |
a acheté un appart |
a failli se noyer |
a rêvé de devenir pianiste |
a vaincu un démon suprême |
a bu du lait tourné |
a ressenti la vieillesse |
s’est gratté le nez |
a acheté une toupie |
s’est fait voler son argent |
a rejoint une société secrète |
a bu de la soupe chaude |
a acheté un chiot |
n’a pas trouvé les toilettes |
a juré de se venger |
n’a pas retrouvé ses papiers |
a failli gagner les élections |
a oublié les raisons de sa colère |
a trouvé que ça puait |
a eu de gros regrets |
n’a pas pu arrêter son hoquet |
a marché dans un truc gluant |
a plié 1 000 grues en origami |
a totalement changé de vie |
a suivi son instinct |
a dû se faire hospitaliser |
s’est fait assommer |
a déclenché une émeute |
a assumé la faute |
a rencontré son âme sœur |
a ri au pire moment |
a payé une vieille dette |
a capturé le vrai criminel |
a essayé d’avoir l’air dangereux |
a oublié sa destination |
a mis un stylo dans son nez |
a refusé de payer une taxe |
a acheté un parfum bon marché |
a dévisagé un tigre affamé |
a fait la loi dans le pogo |
a fait une roue arrière |
n’a pas trahi ses principes |
a créé son blog de lycée |
a créé une sauce barbecue |
a perdu son sang-froid |
a roté |
a appris à jongler |
a rejoint un groupe a capella |
a versé une seule larme |
a renversé la table |
a cherché des crottes de nez |
a perdu une dent |
a admiré son propre postérieur |
a juste un peu bavé |
a repoussé des pirates |
a visité le monde des morts |
a retrouvé l’anneau de pouvoir |
a fait un pacte avec un magicien |
a arrêté le gluten |
a enfin pris la parole |
a trouvé un numéro de téléphone |
a dû fuir le KGB |
a sauté pour ne pas mourir |
n’a fait que plaisanter |
a pris son air blasé |
n’a tiré que des 3 points |
a publié un fanzine |
a campé au point de spawn |
a gonflé un gros ballon |
＠|