มีประสิทธิภาพดีกับศัตรูสีแดง|＠
มีประสิทธิภาพดีกับศัตรูลอย|＠
มีประสิทธิภาพดีกับศัตรูสีดำ|＠
มีประสิทธิภาพดีกับศัตรูโลหะ|＠
มีประสิทธิภาพดีกับศัตรูเทพ|＠
มีประสิทธิภาพดีกับศัตรูเอเลี่ยน|＠
มีประสิทธิภาพดีกับศัตรูซอมบี้|＠
มีประสิทธิภาพดีกับศัตรูซากวัตถุ|＠
มีประสิทธิภาพดีกับศัตรูอากุ|＠
มีประสิทธิภาพดีกับศัตรูที่ไม่มีคุณสมบัติ|＠
＠
＠
＠
＠
＠
【ลดโจมตี】|ระบุประเภทของศัตรูที่จะ|ถูกลดพลังโจมตีเป็นระยะเวลาชั่วครู่หนึ่ง|＠
【เสริมแกร่ง】|หลังจากพลังชีวิตของยูนิตนี้ลดลง|ต่ำกว่าจำนวนที่กำหนด ก็จะโจมตีแรงขึ้นมาก|＠
【หยุดการเคลื่อนไหว】|ระบุประเภทของศัตรูที่จะไม่สามารถ|เคลื่อนที่ได้ตามระยะเวลาที่กำหนดไว้|＠
【ชะลอ】|ระบุประเภทของศัตรูที่จะถูกลดความเร็ว|ตามระยะเวลาที่กำหนดไว้|＠
【รอดชีวิต】|หลังจากพลังชีวิตของยูนิตนี้ลดลงต่ำกว่าศูนย์|ก็จะรักษาตัวเองเป็นจำนวนเล็กน้อย|＠
【จอมทำลายฐาน】|หากยูนิตนี้โจมตีฐานศัตรู|การโจมตีก็จะสร้างดาเมเพิ่มขึ้นเป็นอย่างมาก|＠
【คริติคอล】|การโจมตีของยูนิตนี้จะมีโอกาสสร้างดาเมจ|ตามที่กำหนดไว้ และสามารถทำร้ายศัตรูโลหะได้|＠
【โจมตีเฉพาะ】|การโจมตีของยูนิตนี้จะสร้างดาเมจเฉพาะ|ศัตรูเป้าหมายตามประเภทที่ระบุไว้เท่านั้น|＠
【เก่งกับ】|ประเภทของศัตรูที่ระบุจะได้รับดาเมจเพิ่มขึ้น|และดาเมจที่ได้รับจากประเภทดังกล่าวก็จะลดลงด้วย|＠
【อึด】|ดาเมจที่ได้รับจากศัตรูประเภทที่ระบุไว้|จะลดลงอย่างมาก|＠
【เงินพิเศษ】|รางวัลเงินที่ได้จากการปราบ|ศัตรูประเภทที่ระบุไว้จะเพิ่มขึ้น|＠
【ดาเมจมหาศาล】|ประเภทของศัตรูที่ระบุจะได้รับดาเมจเพิ่ม|มากขึ้นจากการโจมตีของยูนิตนี้|＠
【กระแทกกลับ】|ยูนิตจะมีโอกาสตามที่กำหนดไว้ ที่จะผลัก|ศัตรูประเภทที่ระบุไว้กลับฐานของตนเอง|＠
【คลื่นโจมตี】|การโจมตีจะโจมตีศัตรูทุกตัวในระยะ|สร้างดาเมจเพิ่มเติมจากคลื่นพลังงานที่ปล่อยออกมา|＠
【โลหะ】|จะลดดาเมจจากการโจมตีที่ได้รับเป็นอย่างมาก|แต่ยูนิตจะเปราะบางต่อการโจมตีคริติคอล|＠
【มีภูมิต้านคลื่น】|ยูนิตนี้จะไม่รับดาเมจจากคลื่นโจมตี|＠
【โจมตีพื้นที่】|ยูนิตทุกตัวที่อยู่ภายในขอบเขตการโจมตีของยูนิตนี้|จะได้รับดาเมจจากการโจมตี|＠
【ระยะไกล】|ยูนิตที่อยู่ในระยะไกลจะได้รับดาเมจ|แต่การโจมตีอาจจะพลาดยูนิตที่อยู่ในระยะใกล้ได้|＠
【มีภูมิต้านอ่อนแอ】|การโจมตีของศัตรูจะไม่ลดทอน|การโจมตีของยูนิตนี้|＠
【มีภูมิต้านการหยุดการเคลื่อนไหว】|การโจมตีของศัตรูจะไม่หยุดการเคลื่อนไหว|ของยูนิตนี้|＠
【มีภูมิต้านชะลอ】|การโจมตีของศัตรูจะไม่ทำให้|ยูนิตนี้ช้าลง|＠
【มีภูมิต้านกระแทกกลับ】|การโจมตีของศัตรูจะไม่ทำให้|ยูนิตนี้ถูกกระแทกกลับ|＠
【โจมตีเดี่ยว】|จะมีเฉพาะศัตรูในระยะเพียงตัวเดียวเท่านั้น|ที่จะโดนการโจมตีของยูนิตนี้|＠
【นักฆ่าแม่มด】|บูสต์การโจมตีและป้องกันอย่างหนักหน่วงต่อ|ศัตรูแม่มดในด่านคอลแลบของสาวน้อยเวทมนตร์ มาโดกะ|＠
【นักฆ่าซอมบี้】|ยูนิตที่มีความสามารถนี้จะสามารถป้องกัน|ศัตรูซอมบี้จากการฟื้นชีพขึ้นมาใหม่ได้|＠
【โล่คลื่น】|ยูนิตนี้สามารถปัดคลื่นโจมตีและ|คุ้มครองยูนิตที่อยู่ข้างหลังจากเอฟเฟกต์ได้|＠
【นักทะลวงบาเรีย】|มีโอกาสทำลายบาเรียของศัตรู|และสร้างดาเมจมหาศาลเมื่อทำลายได้|＠
【ตัวบล็อกวาร์ป】|ความสามารถการวาร์ปของศัตรู|จะไม่ส่งผลต่อยูนิตนี้|＠
【โจมตีทุกทิศทาง】|โจมตีศัตรูทั้งข้างหน้าและข้างหลัง|เป็นบริเวณกว้าง|＠
【EVA Angel Killer】|Delivers extra damage to / takes less|damage from EVANGELION Collab bosses|＠
【มีภูมิต้านคำสาป】|มีภูมิต้านทานเอฟเฟกต์สถานะชั่วคราว|ที่เกิดขึ้นจากคำสาปของศัตรู|＠
【วาร์ป】|การโจมตีอาจจะทำให้ศัตรูโดนวาร์ป|＠
【ทนต่ออ่อนแอ】|เอฟเฟกต์ลดทอนที่เกิดขึ้นจากศัตรู|จะมีโอกาสส่งผลลดลง|＠
【ทนต่อการหยุดการเคลื่อนไหว】|เอฟเฟกต์หยุดการเคลื่อนไหวที่เกิดขึ้นจากศัตรู|จะมีโอกาสส่งผลลดลง|＠
【ทนต่อชะลอ】|เอฟเฟกต์ชะลอที่เกิดขึ้นจากศัตรู|จะมีโอกาสส่งผลลดลง|＠
【ทนต่อกระแทกกลับ】|เอฟเฟกต์กระแทกกลับที่เกิดขึ้นจากศัตรู|จะมีโอกาสส่งผลลดลง|＠
【ทนต่อคลื่น】|คลื่นโจมตีของศัตรูจะสร้างดาเมจลดลง|＠
【ทนต่อวาร์ป】|เอฟเฟกต์วาร์ปที่เกิดขึ้นจากศัตรู|จะมีโอกาสส่งผลลดลง|＠
【ราคาลดลง】|ลดค่าใช้งานยูนิต|＠
【เร่งความเร็วฟื้นฟู】|ยูนิตจะพร้อมใช้งานเร็วขึ้น|＠
【เร่งความเร็วเคลื่อนที่】|ยูนิตจะเคลื่อนที่เร็วขึ้น|＠
【การกระแทกกลับที่ดีขึ้น】|เพิ่มโอกาสกระแทกกลับ|＠
【ทนต่อคำสาป】|เอฟเฟกต์สาปที่เกิดขึ้นจากศัตรู|จะมีโอกาสส่งผลลดลง|＠
【บัฟโจมตี】|เพิ่มค่าโจมตีพื้นฐานโดยถาวร|＠
【บัฟป้องกัน】|เพิ่มค่าป้องกันพื้นฐานโดยถาวร|＠
【ดาเมจบ้าคลั่ง】|เพิ่มดาเมจที่มีต่อศัตรูเป้าหมาย|อย่างมหาศาล|＠
【โคตรอึด】|ลดดาเมจที่ได้รับจากศัตรูเป้าหมาย|อย่างมหาศาล|＠
【เป้าหมายสีแดง】|ความสามารถจะส่งผลต่อศัตรูสีแดงด้วย|＠
【เป้าหมายลอย】|ความสามารถจะส่งผลต่อศัตรูลอยด้วย|＠
【เป้าหมายสีดำ】|ความสามารถจะส่งผลต่อศัตรูสีดำด้วย|＠
【เป้าหมายโลหะ】|ความสามารถจะส่งผลต่อศัตรูโลหะด้วย|＠
【เป้าหมายเทพ】|ความสามารถจะส่งผลต่อศัตรูเทพด้วย|＠
【เป้าหมายเอเลี่ยน】|ความสามารถจะส่งผลต่อศัตรูเอเลี่ยนด้วย|＠
【เป้าหมายซอมบี้】|ความสามารถจะส่งผลต่อศัตรูซอมบี้ด้วย|＠
【เป้าหมายซากวัตถุ】|ความสามารถจะส่งผลต่อศัตรูซากวัตถุด้วย|＠
【เป้าหมายไร้คุณสมบัติ】|ความสามารถจะส่งผลต่อศัตรูไร้คุณสมบัติด้วย|＠
【ฟาดฟันป่าเถื่อน】|มีโอกาสตามที่กำหนดไว้ในการสร้างดาเมจเพิ่มขึ้นปริมาณมาก|＠
【หลบหลีกการโจมตี】|หลีกเลี่ยงดาเมจทั้งหมดที่เกิดจากการโจมตี|ของศัตรูที่เป็นเป้าหมายเป็นการชั่วคราว|＠
【โจมตีโหมกระหน่ำ】|การโจมตีที่สำเร็จจะสร้างดาเมจเพิ่มเติม|ให้แก่ส่วนต่างๆ แบบสุ่มในพื้นที่โจมตีของตัวเอง|＠
【มีภูมิต้านพิษ】|มีภูมิต้านเอฟเฟกต์พิษที่เกิดจากการโจมตีของศัตรู!|＠
【สาป】|ศัตรูจะไม่สามารถสร้าง|เอฟเฟกต์สถานะด้านลบได้เป็นเวลาสั้นๆ|＠
【เลี่ยงการโจมตีโหมกระหน่ำ】|จะไม่ได้รับดาเมจโหมกระหน่ำที่เกิดจากการโจมตีของศัตรู|＠
【คลื่นจิ๋ว】|การโจมตีที่สำเร็จอาจจะสร้างดาเมจเพิ่มเติม|ให้แก่ศัตรูที่อยู่ในระยะของการโจมตีคลื่นเล็ก|＠
【ทนต่อพิษ】|เอฟเฟกต์พิษที่เกิดขึ้นจากศัตรู|จะมีโอกาสส่งผลลดลง|＠
【ทนโจมตีโหมกระหน่ำ】|การโจมตีโหมกระหน่ำของศัตรูจะสร้างดาเมจลดลง|＠
【เจาะทะลุโล่】|การโจมตีจะมีโอกาสตามที่กำหนดไว้ในการทำลาย|โล่อากุและสร้างดาเมจมหาศาลได้|＠
【เป้าหมายอากุ】|ความสามารถจะส่งผลต่อศัตรูอากุด้วย|＠
【มือสังหารยักษ์】|เพิ่มดาเมจโจมตีและ|ป้องกันเมื่อปะทะกับศัตรูยักษ์|＠
【จู่โจมวิญญาณ】|การโจมตีจะสร้างดาเมจ|ต่อศัตรูซอมบี้ที่ "ตาย" ไปแล้วชั่วคราว|＠
【มือสังหารเบอฮีมอธ】|เพิ่มดาเมจโจมตีและการป้องกันอย่างมาก|ต่อเบอฮีมอธ พร้อมโอกาสหลบหลีก|＠
【เพิ่มความถี่การโจมตี】|เวลาระหว่างโจมตีลดลง|＠
【โหมกระหน่ำจิ๋ว】|เมื่อโจมตีสำเร็จจะปล่อยการโหมกระหน่ำที่|สร้างดาเมจเพิ่มเติมไปยังตำแหน่งสุ่ม|＠
【โหมกระหน่ำสวน】|เมื่อถูกศัตรูโจมตีโหมกระหน่ำ |จะโต้กลับเองด้วยการโจมตีโหมกระหน่ำ|＠
【นักปลุกวิญญาณ】|แตะที่ไอคอนเพื่อปลุกวิญญาณขึ้นมาโจมตีศัตรู|ใช้ยูนิตได้แค่ครั้งละตัวเท่านั้น|＠
【มือปราบนักปราชญ์】|เพิ่มดาเมจต่อนักปราชญ์|ลดดาเมจและเอฟเฟกต์ดีบัฟที่ได้รับ|ทั้งยังลบล้างภูมิต้านดีบัฟต่างๆ ของศัตรูนักปราชญ์|＠
【นักฆ่าโลหะ】|สร้างดาเมจต่อศัตรูโลหะ|ตามระดับพลังชีวิตคงเหลือของศัตรูที่เป็นเป้าหมาย|＠
＠
＠
＠
＠
＠
【ระเบิด】|เมื่อโจมตีสำเร็จ จะปล่อยพลังระเบิดทำลายล้าง|ที่แผ่ไปทั้งทางซ้ายและขวา|＠
【มีภูมิต้านระเบิด】|ไม่ได้รับดาเมจจากการระเบิดของศัตรู|＠