สัญญาณอันตราย 1|สัญญาณอันตราย 2|สัญญาณอันตราย 3|สัญญาณอันตราย 4|สัญญาณอันตราย 5|สัญญาณอันตราย 6|สัญญาณอันตราย 7|สัญญาณอันตราย 8|สัญญาณอันตราย 9|สัญญาณอันตราย 10|สัญญาณอันตราย 11|สัญญาณอันตราย 12|สัญญาณอันตราย 13|สัญญาณอันตราย 14|สัญญาณอันตราย 15|สัญญาณอันตราย 16|สัญญาณอันตราย 17|สัญญาณอันตราย 18|สัญญาณอันตราย 19|สัญญาณอันตราย 20|＠
สัญญาณอันตราย 21|สัญญาณอันตราย 22|สัญญาณอันตราย 23|สัญญาณอันตราย 24|สัญญาณอันตราย 25|สัญญาณอันตราย 26|สัญญาณอันตราย 27|สัญญาณอันตราย 28|สัญญาณอันตราย 29|สัญญาณอันตราย 30|สัญญาณอันตราย 31|สัญญาณอันตราย 32|สัญญาณอันตราย 33|สัญญาณอันตราย 34|สัญญาณอันตราย 35|สัญญาณอันตราย 36|สัญญาณอันตราย 37|สัญญาณอันตราย 38|สัญญาณอันตราย 39|สัญญาณอันตราย 40|＠
สัญญาณอันตราย 41|สัญญาณอันตราย 42|สัญญาณอันตราย 43|สัญญาณอันตราย 44|สัญญาณอันตราย 45|สัญญาณอันตราย 46|สัญญาณอันตราย 47|สัญญาณอันตราย 48|สัญญาณอันตราย 49|สัญญาณอันตราย 50|สัญญาณอันตราย 51|สัญญาณอันตราย 52|สัญญาณอันตราย 53|สัญญาณอันตราย 54|สัญญาณอันตราย 55|สัญญาณอันตราย 56|สัญญาณอันตราย 57|สัญญาณอันตราย 58|สัญญาณอันตราย 59|สัญญาณอันตราย 60|＠
อาละวาดเลเวล 1|อาละวาดเลเวล 2|อาละวาดเลเวล 3|อาละวาดเลเวล 4|อาละวาดเลเวล 5|อาละวาดเลเวล 6|อาละวาดเลเวล 7|อาละวาดเลเวล 8|อาละวาดเลเวล 9|อาละวาดเลเวล 10|อาละวาดเลเวล 11|อาละวาดเลเวล 12|อาละวาดเลเวล 13|อาละวาดเลเวล 14|อาละวาดเลเวล 15|อาละวาดเลเวล 16|อาละวาดเลเวล 17|อาละวาดเลเวล 18|อาละวาดเลเวล 19|อาละวาดเลเวล 20|＠
อาละวาดเลเวล 21|อาละวาดเลเวล 22|อาละวาดเลเวล 23|อาละวาดเลเวล 24|อาละวาดเลเวล 25|อาละวาดเลเวล 26|อาละวาดเลเวล 27|อาละวาดเลเวล 28|อาละวาดเลเวล 29|อาละวาดเลเวล 30|อาละวาดเลเวล 31|อาละวาดเลเวล 32|อาละวาดเลเวล 33|อาละวาดเลเวล 34|อาละวาดเลเวล 35|อาละวาดเลเวล 36|อาละวาดเลเวล 37|อาละวาดเลเวล 38|อาละวาดเลเวล 39|อาละวาดเลเวล 40|＠
อาละวาดเลเวล 41|อาละวาดเลเวล 42|อาละวาดเลเวล 43|อาละวาดเลเวล 44|อาละวาดเลเวล 45|อาละวาดเลเวล 46|อาละวาดเลเวล 47|อาละวาดเลเวล 48|อาละวาดเลเวล 49|อาละวาดเลเวล 50|อาละวาดเลเวล 51|อาละวาดเลเวล 52|อาละวาดเลเวล 53|อาละวาดเลเวล 54|อาละวาดเลเวล 55|อาละวาดเลเวล 56|อาละวาดเลเวล 57|อาละวาดเลเวล 58|อาละวาดเลเวล 59|อาละวาดเลเวล 60|＠
ด้วยปีกทรงพลังเลเวล 1|ด้วยปีกทรงพลังเลเวล 2|ด้วยปีกทรงพลังเลเวล 3|ด้วยปีกทรงพลังเลเวล 4|ด้วยปีกทรงพลังเลเวล 5|ด้วยปีกทรงพลังเลเวล 6|ด้วยปีกทรงพลังเลเวล 7|ด้วยปีกทรงพลังเลเวล 8|ด้วยปีกทรงพลังเลเวล 9|ด้วยปีกทรงพลังเลเวล 10|ด้วยปีกทรงพลังเลเวล 11|ด้วยปีกทรงพลังเลเวล 12|ด้วยปีกทรงพลังเลเวล 13|ด้วยปีกทรงพลังเลเวล 14|ด้วยปีกทรงพลังเลเวล 15|ด้วยปีกทรงพลังเลเวล 16|ด้วยปีกทรงพลังเลเวล 17|ด้วยปีกทรงพลังเลเวล 18|ด้วยปีกทรงพลังเลเวล 19|ด้วยปีกทรงพลังเลเวล 20|＠
ด้วยปีกทรงพลังเลเวล 21|ด้วยปีกทรงพลังเลเวล 22|ด้วยปีกทรงพลังเลเวล 23|ด้วยปีกทรงพลังเลเวล 24|ด้วยปีกทรงพลังเลเวล 25|ด้วยปีกทรงพลังเลเวล 26|ด้วยปีกทรงพลังเลเวล 27|ด้วยปีกทรงพลังเลเวล 28|ด้วยปีกทรงพลังเลเวล 29|ด้วยปีกทรงพลังเลเวล 30|ด้วยปีกทรงพลังเลเวล 31|ด้วยปีกทรงพลังเลเวล 32|ด้วยปีกทรงพลังเลเวล 33|ด้วยปีกทรงพลังเลเวล 34|ด้วยปีกทรงพลังเลเวล 35|ด้วยปีกทรงพลังเลเวล 36|ด้วยปีกทรงพลังเลเวล 37|ด้วยปีกทรงพลังเลเวล 38|ด้วยปีกทรงพลังเลเวล 39|ด้วยปีกทรงพลังเลเวล 40|＠
ด้วยปีกทรงพลังเลเวล 41|ด้วยปีกทรงพลังเลเวล 42|ด้วยปีกทรงพลังเลเวล 43|ด้วยปีกทรงพลังเลเวล 44|ด้วยปีกทรงพลังเลเวล 45|ด้วยปีกทรงพลังเลเวล 46|ด้วยปีกทรงพลังเลเวล 47|ด้วยปีกทรงพลังเลเวล 48|ด้วยปีกทรงพลังเลเวล 49|ด้วยปีกทรงพลังเลเวล 50|ด้วยปีกทรงพลังเลเวล 51|ด้วยปีกทรงพลังเลเวล 52|ด้วยปีกทรงพลังเลเวล 53|ด้วยปีกทรงพลังเลเวล 54|ด้วยปีกทรงพลังเลเวล 55|ด้วยปีกทรงพลังเลเวล 56|ด้วยปีกทรงพลังเลเวล 57|ด้วยปีกทรงพลังเลเวล 58|ด้วยปีกทรงพลังเลเวล 59|ด้วยปีกทรงพลังเลเวล 60|＠
เจ้าพลังจักรวาลเลเวล 1|เจ้าพลังจักรวาลเลเวล 2|เจ้าพลังจักรวาลเลเวล 3|เจ้าพลังจักรวาลเลเวล 4|เจ้าพลังจักรวาลเลเวล 5|เจ้าพลังจักรวาลเลเวล 6|เจ้าพลังจักรวาลเลเวล 7|เจ้าพลังจักรวาลเลเวล 8|เจ้าพลังจักรวาลเลเวล 9|เจ้าพลังจักรวาลเลเวล 10|เจ้าพลังจักรวาลเลเวล 11|เจ้าพลังจักรวาลเลเวล 12|เจ้าพลังจักรวาลเลเวล 13|เจ้าพลังจักรวาลเลเวล 14|เจ้าพลังจักรวาลเลเวล 15|เจ้าพลังจักรวาลเลเวล 16|เจ้าพลังจักรวาลเลเวล 17|เจ้าพลังจักรวาลเลเวล 18|เจ้าพลังจักรวาลเลเวล 19|เจ้าพลังจักรวาลเลเวล 20|＠
เจ้าพลังจักรวาลเลเวล 21|เจ้าพลังจักรวาลเลเวล 22|เจ้าพลังจักรวาลเลเวล 23|เจ้าพลังจักรวาลเลเวล 24|เจ้าพลังจักรวาลเลเวล 25|เจ้าพลังจักรวาลเลเวล 26|เจ้าพลังจักรวาลเลเวล 27|เจ้าพลังจักรวาลเลเวล 28|เจ้าพลังจักรวาลเลเวล 29|เจ้าพลังจักรวาลเลเวล 30|เจ้าพลังจักรวาลเลเวล 31|เจ้าพลังจักรวาลเลเวล 32|เจ้าพลังจักรวาลเลเวล 33|เจ้าพลังจักรวาลเลเวล 34|เจ้าพลังจักรวาลเลเวล 35|เจ้าพลังจักรวาลเลเวล 36|เจ้าพลังจักรวาลเลเวล 37|เจ้าพลังจักรวาลเลเวล 38|เจ้าพลังจักรวาลเลเวล 39|เจ้าพลังจักรวาลเลเวล 40|＠
เจ้าพลังจักรวาลเลเวล 41|เจ้าพลังจักรวาลเลเวล 42|เจ้าพลังจักรวาลเลเวล 43|เจ้าพลังจักรวาลเลเวล 44|เจ้าพลังจักรวาลเลเวล 45|เจ้าพลังจักรวาลเลเวล 46|เจ้าพลังจักรวาลเลเวล 47|เจ้าพลังจักรวาลเลเวล 48|เจ้าพลังจักรวาลเลเวล 49|เจ้าพลังจักรวาลเลเวล 50|เจ้าพลังจักรวาลเลเวล 51|เจ้าพลังจักรวาลเลเวล 52|เจ้าพลังจักรวาลเลเวล 53|เจ้าพลังจักรวาลเลเวล 54|เจ้าพลังจักรวาลเลเวล 55|เจ้าพลังจักรวาลเลเวล 56|เจ้าพลังจักรวาลเลเวล 57|เจ้าพลังจักรวาลเลเวล 58|เจ้าพลังจักรวาลเลเวล 59|เจ้าพลังจักรวาลเลเวล 60|＠
ปีฉลูเลเวล 1|ปีฉลูเลเวล 2|ปีฉลูเลเวล 3|ปีฉลูเลเวล 4|ปีฉลูเลเวล 5|ปีฉลูเลเวล 6|ปีฉลูเลเวล 7|ปีฉลูเลเวล 8|ปีฉลูเลเวล 9|ปีฉลูเลเวล 10|＠
ช็อกโกป่วนเลเวล 1|ช็อกโกป่วนเลเวล 2|ช็อกโกป่วนเลเวล 3|ช็อกโกป่วนเลเวล 4|ช็อกโกป่วนเลเวล 5|ช็อกโกป่วนเลเวล 6|ช็อกโกป่วนเลเวล 7|ช็อกโกป่วนเลเวล 8|ช็อกโกป่วนเลเวล 9|ช็อกโกป่วนเลเวล 10|ช็อกโกป่วนเลเวล 11|ช็อกโกป่วนเลเวล 12|ช็อกโกป่วนเลเวล 13|ช็อกโกป่วนเลเวล 14|ช็อกโกป่วนเลเวล 15|ช็อกโกป่วนเลเวล 16|ช็อกโกป่วนเลเวล 17|ช็อกโกป่วนเลเวล 18|ช็อกโกป่วนเลเวล 19|ช็อกโกป่วนเลเวล 20|＠
ไข่แห่งความโกลาหลเลเวล 1|ไข่แห่งความโกลาหลเลเวล 2|ไข่แห่งความโกลาหลเลเวล 3|ไข่แห่งความโกลาหลเลเวล 4|ไข่แห่งความโกลาหลเลเวล 5|ไข่แห่งความโกลาหลเลเวล 6|ไข่แห่งความโกลาหลเลเวล 7|ไข่แห่งความโกลาหลเลเวล 8|ไข่แห่งความโกลาหลเลเวล 9|ไข่แห่งความโกลาหลเลเวล 10|ไข่แห่งความโกลาหลเลเวล 11|ไข่แห่งความโกลาหลเลเวล 12|ไข่แห่งความโกลาหลเลเวล 13|ไข่แห่งความโกลาหลเลเวล 14|ไข่แห่งความโกลาหลเลเวล 15|ไข่แห่งความโกลาหลเลเวล 16|ไข่แห่งความโกลาหลเลเวล 17|ไข่แห่งความโกลาหลเลเวล 18|ไข่แห่งความโกลาหลเลเวล 19|ไข่แห่งความโกลาหลเลเวล 20|＠
ต้องห้ามเลเวล 1|ต้องห้ามเลเวล 2|ต้องห้ามเลเวล 3|ต้องห้ามเลเวล 4|ต้องห้ามเลเวล 5|ต้องห้ามเลเวล 6|ต้องห้ามเลเวล 7|ต้องห้ามเลเวล 8|ต้องห้ามเลเวล 9|ต้องห้ามเลเวล 10|＠
ต้องห้าม II เลเวล 11|ต้องห้าม II เลเวล 12|ต้องห้าม II เลเวล 13|ต้องห้าม II เลเวล 14|ต้องห้าม II เลเวล 15|ต้องห้าม II เลเวล 16|ต้องห้าม II เลเวล 17|ต้องห้าม II เลเวล 18|ต้องห้าม II เลเวล 19|ต้องห้าม II เลเวลสูงสุด|＠
ฤดูร้อนเลเวล 1|ฤดูร้อนเลเวล 2|ฤดูร้อนเลเวล 3|ฤดูร้อนเลเวล 4|ฤดูร้อนเลเวล 5|ฤดูร้อนเลเวล 6|ฤดูร้อนเลเวล 7|ฤดูร้อนเลเวล 8|ฤดูร้อนเลเวล 9|ฤดูร้อนเลเวล 10|＠
ไม่ใช่ฤดูร้อนเลเวล 11|ไม่ใช่ฤดูร้อนเลเวล 12|ไม่ใช่ฤดูร้อนเลเวล 13|ไม่ใช่ฤดูร้อนเลเวล 14|ไม่ใช่ฤดูร้อนเลเวล 15|ไม่ใช่ฤดูร้อนเลเวล 16|ไม่ใช่ฤดูร้อนเลเวล 17|ไม่ใช่ฤดูร้อนเลเวล 18|ไม่ใช่ฤดูร้อนเลเวล 19|ไม่ใช่ฤดูร้อนเลเวลสูงสุด|＠
เริ่มต้นฤดูร้อน|คอรัสอัสดง|แสงไฟอาบ|บ้านต้นไม้ลับตา|เรียกมื้อเย็น|กลิ่นซิโตรเนลล่า|ของพิเศษยามดึก|จับตาข่ายให้แน่น|สมบัติพื้นทะเล|พ่นละอองกันแมลง|เต้นรำลานโรงเรียน|สตรีน่าหลงใหล|เด็กชายผิวแทนแดด|เสียงเพลงจากระยะไกล|เพื่อนที่สูญหาย|ตื่นตอนเที่ยงวัน|อ่าวลับ|สัญญาณของฤดูใบไม้ร่วง|พลุสุดท้าย|การบ้านนาทีสุดท้าย|＠
สัญญาณอันตราย 1|สัญญาณอันตราย 2|สัญญาณอันตราย 3|สัญญาณอันตราย 4|สัญญาณอันตราย 5|สัญญาณอันตราย 6|สัญญาณอันตราย 7|สัญญาณอันตราย 8|สัญญาณอันตราย 9|สัญญาณอันตราย 10|สัญญาณอันตราย 11|สัญญาณอันตราย 12|สัญญาณอันตราย 13|สัญญาณอันตราย 14|สัญญาณอันตราย 15|สัญญาณอันตราย 16|สัญญาณอันตราย 17|สัญญาณอันตราย 18|สัญญาณอันตราย 19|สัญญาณอันตรายสูงสุด|＠
แขกบ้านเลเวล 1|แขกบ้านเลเวล 2|แขกบ้านเลเวล 3|แขกบ้านเลเวล 4|แขกบ้านเลเวล 5|แขกบ้านเลเวล 6|แขกบ้านเลเวล 7|แขกบ้านเลเวล 8|แขกบ้านเลเวล 9|แขกบ้านเลเวล 10|＠
คนแปลกหน้าเลเวล 11|คนแปลกหน้าเลเวล 12|คนแปลกหน้าเลเวล 13|คนแปลกหน้าเลเวล 14|คนแปลกหน้าเลเวล 15|คนแปลกหน้าเลเวล 16|คนแปลกหน้าเลเวล 17|คนแปลกหน้าเลเวล 18|คนแปลกหน้าเลเวล 19|คนแปลกหน้าเลเวลสูงสุด|＠
เจนโลกเลเวล 1|เจนโลกเลเวล 2|เจนโลกเลเวล 3|เจนโลกเลเวล 4|เจนโลกเลเวล 5|เจนโลกเลเวล 6|เจนโลกเลเวล 7|เจนโลกเลเวล 8|เจนโลกเลเวล 9|เจนโลกเลเวล 10|＠
ในเมืองเลเวล 11|ในเมืองเลเวล 12|ในเมืองเลเวล 13|ในเมืองเลเวล 14|ในเมืองเลเวล 15|ในเมืองเลเวล 16|ในเมืองเลเวล 17|ในเมืองเลเวล 18|ในเมืองเลเวล 19|ในเมืองเลเวลสูงสุด|＠
วันแข่งกีฬาเลเวล 1|วันแข่งกีฬาเลเวล 2|วันแข่งกีฬาเลเวล 3|วันแข่งกีฬาเลเวล 4|วันแข่งกีฬาเลเวล 5|วันแข่งกีฬาเลเวล 6|วันแข่งกีฬาเลเวล 7|วันแข่งกีฬาเลเวล 8|วันแข่งกีฬาเลเวล 9|วันแข่งกีฬาเลเวล 10|＠
คืนแข่งกีฬาเลเวล 11|คืนแข่งกีฬาเลเวล 12|คืนแข่งกีฬาเลเวล 13|คืนแข่งกีฬาเลเวล 14|คืนแข่งกีฬาเลเวล 15|คืนแข่งกีฬาเลเวล 16|คืนแข่งกีฬาเลเวล 17|คืนแข่งกีฬาเลเวล 18|คืนแข่งกีฬาเลเวล 19|คืนแข่งกีฬาเลเวลสูงสุด|＠
อาละวาดเลเวล 1|อาละวาดเลเวล 2|อาละวาดเลเวล 3|อาละวาดเลเวล 4|อาละวาดเลเวล 5|อาละวาดเลเวล 6|อาละวาดเลเวล 7|อาละวาดเลเวล 8|อาละวาดเลเวล 9|อาละวาดเลเวล 10|อาละวาดเลเวล 11|อาละวาดเลเวล 12|อาละวาดเลเวล 13|อาละวาดเลเวล 14|อาละวาดเลเวล 15|อาละวาดเลเวล 16|อาละวาดเลเวล 17|อาละวาดเลเวล 18|อาละวาดเลเวล 19|อาละวาดเลเวลสูงสุด|＠
แรงงานเลเวล 1|แรงงานเลเวล 2|แรงงานเลเวล 3|แรงงานเลเวล 4|แรงงานเลเวล 5|แรงงานเลเวล 6|แรงงานเลเวล 7|แรงงานเลเวล 8|แรงงานเลเวล 9|แรงงานเลเวล 10|＠
ปฏิวัติเลเวล 11|ปฏิวัติเลเวล 12|ปฏิวัติเลเวล 13|ปฏิวัติเลเวล 14|ปฏิวัติเลเวล 15|ปฏิวัติเลเวล 16|ปฏิวัติเลเวล 17|ปฏิวัติเลเวล 18|ปฏิวัติเลเวล 19|ปฏิวัติเลเวลสูงสุด|＠
แมวจิงเกิ้ลเลเวล 1|แมวจิงเกิ้ลเลเวล 2|แมวจิงเกิ้ลเลเวล 3|แมวจิงเกิ้ลเลเวล 4|แมวจิงเกิ้ลเลเวล 5|แมวจิงเกิ้ลเลเวล 6|แมวจิงเกิ้ลเลเวล 7|แมวจิงเกิ้ลเลเวล 8|แมวจิงเกิ้ลเลเวล 9|แมวจิงเกิ้ลเลเวล 10|＠
ในอวกาศเลเวล 11|ในอวกาศเลเวล 12|ในอวกาศเลเวล 13|ในอวกาศเลเวล 14|ในอวกาศเลเวล 15|ในอวกาศเลเวล 16|ในอวกาศเลเวล 17|ในอวกาศเลเวล 18|ในอวกาศเลเวล 19|ในอวกาศเลเวลสูงสุด|＠
ปีใหม่? เลเวล 1|ปีใหม่? เลเวล 2|ปีใหม่? เลเวล 3|ปีใหม่? เลเวล 4|ปีใหม่? เลเวล 5|ปีใหม่? เลเวล 6|ปีใหม่? เลเวล 7|ปีใหม่? เลเวล 8|ปีใหม่? เลเวล 9|ปีใหม่? เลเวล 10|＠
อีกปีหนึ่งเลเวล 11|อีกปีหนึ่งเลเวล 12|อีกปีหนึ่งเลเวล 13|อีกปีหนึ่งเลเวล 14|อีกปีหนึ่งเลเวล 15|อีกปีหนึ่งเลเวล 16|อีกปีหนึ่งเลเวล 17|อีกปีหนึ่งเลเวล 18|อีกปีหนึ่งเลเวล 19|อีกปีหนึ่งเลเวลสูงสุด|＠
