ด้วยปีกทรงพลังเลเวล 1|ด้วยปีกทรงพลังเลเวล 2|ด้วยปีกทรงพลังเลเวล 3|ด้วยปีกทรงพลังเลเวล 4|ด้วยปีกทรงพลังเลเวล 5|ด้วยปีกทรงพลังเลเวล 6|ด้วยปีกทรงพลังเลเวล 7|ด้วยปีกทรงพลังเลเวล 8|ด้วยปีกทรงพลังเลเวล 9|ด้วยปีกทรงพลังเลเวล 10|ด้วยปีกทรงพลังเลเวล 11|ด้วยปีกทรงพลังเลเวล 12|ด้วยปีกทรงพลังเลเวล 13|ด้วยปีกทรงพลังเลเวล 14|ด้วยปีกทรงพลังเลเวล 15|ด้วยปีกทรงพลังเลเวล 16|ด้วยปีกทรงพลังเลเวล 17|ด้วยปีกทรงพลังเลเวล 18|ด้วยปีกทรงพลังเลเวล 19|ด้วยปีกทรงพลังเลเวลสูงสุด|＠
เจ้าพลังจักรวาลเลเวล 1|เจ้าพลังจักรวาลเลเวล 2|เจ้าพลังจักรวาลเลเวล 3|เจ้าพลังจักรวาลเลเวล 4|เจ้าพลังจักรวาลเลเวล 5|เจ้าพลังจักรวาลเลเวล 6|เจ้าพลังจักรวาลเลเวล 7|เจ้าพลังจักรวาลเลเวล 8|เจ้าพลังจักรวาลเลเวล 9|เจ้าพลังจักรวาลเลเวล 10|เจ้าพลังจักรวาลเลเวล 11|เจ้าพลังจักรวาลเลเวล 12|เจ้าพลังจักรวาลเลเวล 13|เจ้าพลังจักรวาลเลเวล 14|เจ้าพลังจักรวาลเลเวล 15|เจ้าพลังจักรวาลเลเวล 16|เจ้าพลังจักรวาลเลเวล 17|เจ้าพลังจักรวาลเลเวล 18|เจ้าพลังจักรวาลเลเวล 19|เจ้าพลังจักรวาลเลเวลสูงสุด|＠
ปีขาลเลเวล 1|ปีขาลเลเวล 2|ปีขาลเลเวล 3|ปีขาลเลเวล 4|ปีขาลเลเวล 5|ปีขาลเลเวล 6|ปีขาลเลเวล 7|ปีขาลเลเวล 8|ปีขาลเลเวล 9|ปีขาลเลเวล 10|＠
อวยพรเลเวล 1|อวยพรเลเวล 2|อวยพรเลเวล 3|อวยพรเลเวล 4|อวยพรเลเวล 5|อวยพรเลเวล 6|อวยพรเลเวล 7|อวยพรเลเวล 8|อวยพรเลเวล 9|อวยพรเลเวล 10|อวยพรเลเวล 11|อวยพรเลเวล 12|อวยพรเลเวล 13|อวยพรเลเวล 14|อวยพรเลเวล 15|อวยพรเลเวล 16|อวยพรเลเวล 17|อวยพรเลเวล 18|อวยพรเลเวล 19|อวยพรเลเวลสูงสุด|＠
พเนจรเลเวล 1|พเนจรเลเวล 2|พเนจรเลเวล 3|พเนจรเลเวล 4|พเนจรเลเวล 5|พเนจรเลเวล 6|พเนจรเลเวล 7|พเนจรเลเวล 8|พเนจรเลเวล 9|พเนจรเลเวล 10|พเนจรเลเวล 11|พเนจรเลเวล 12|พเนจรเลเวล 13|พเนจรเลเวล 14|พเนจรเลเวล 15|พเนจรเลเวล 16|พเนจรเลเวล 17|พเนจรเลเวล 18|พเนจรเลเวล 19|พเนจรเลเวลสูงสุด|＠
ความสุขเลเวล 1|ความสุขเลเวล 2|ความสุขเลเวล 3|ความสุขเลเวล 4|ความสุขเลเวล 5|ความสุขเลเวล 6|ความสุขเลเวล 7|ความสุขเลเวล 8|ความสุขเลเวล 9|ความสุขเลเวล 10|＠
ความสับสนเลเวล 1|ความสับสนเลเวล 2|ความสับสนเลเวล 3|ความสับสนเลเวล 4|ความสับสนเลเวล 5|ความสับสนเลเวล 6|ความสับสนเลเวล 7|ความสับสนเลเวล 8|ความสับสนเลเวล 9|ความสับสนเลเวลสูงสุด|＠
ตรุษจีนแล้วเหรอเนี่ย?|การแสดงพลุแสงแวบวับ|กำจัดความชั่วด้วยความปัง|อ้อนวอนขอของขวัญ|ภาวนาขอชีวิตยืนยาว|เต้นกายกรรมสิงโต|ตกแต่งเพื่อโชคดี|โคมไฟแดงมงคล|อิ่มเกี๊ยว|เส้นทางกลับบ้านอันยาวไกล|＠
กระหายเลือดเลเวล 1|กระหายเลือดเลเวล 2|กระหายเลือดเลเวล 3|กระหายเลือดเลเวล 4|กระหายเลือดเลเวล 5|กระหายเลือดเลเวล 6|กระหายเลือดเลเวล 7|กระหายเลือดเลเวล 8|กระหายเลือดเลเวล 9|กระหายเลือดเลเวลสูงสุด|＠
เปลือยเปล่าเลเวล 1|เปลือยเปล่าเลเวล 2|เปลือยเปล่าเลเวล 3|เปลือยเปล่าเลเวล 4|เปลือยเปล่าเลเวล 5|เปลือยเปล่าเลเวล 6|เปลือยเปล่าเลเวล 7|เปลือยเปล่าเลเวล 8|เปลือยเปล่าเลเวล 9|เปลือยเปล่าเลเวล 10|＠
กลับมาเลเวล 11|กลับมาเลเวล 12|กลับมาเลเวล 13|กลับมาเลเวล 14|กลับมาเลเวล 15|กลับมาเลเวล 16|กลับมาเลเวล 17|กลับมาเลเวล 18|กลับมาเลเวล 19|กลับมาเลเวลสูงสุด|＠
ของขวัญปลอบใจเลเวล 1|ของขวัญปลอบใจเลเวล 2|ของขวัญปลอบใจเลเวล 3|ของขวัญปลอบใจเลเวล 4|ของขวัญปลอบใจเลเวล 5|ของขวัญปลอบใจเลเวล 6|ของขวัญปลอบใจเลเวล 7|ของขวัญปลอบใจเลเวล 8|ของขวัญปลอบใจเลเวล 9|ของขวัญปลอบใจเลเวล 10|ของขวัญปลอบใจเลเวล 11|ของขวัญปลอบใจเลเวล 12|ของขวัญปลอบใจเลเวล 13|ของขวัญปลอบใจเลเวล 14|ของขวัญปลอบใจเลเวล 15|ของขวัญปลอบใจเลเวล 16|ของขวัญปลอบใจเลเวล 17|ของขวัญปลอบใจเลเวล 18|ของขวัญปลอบใจเลเวล 19|ของขวัญปลอบใจเลเวลสูงสุด|＠
ครู! เลเวล 1|ครู! เลเวล 2|ครู! เลเวล 3|ครู! เลเวล 4|ครู! เลเวล 5|ครู! เลเวล 6|ครู! เลเวล 7|ครู! เลเวล 8|ครู! เลเวล 9|ครู! เลเวล 10|＠
เซ็นเซ! เลเวล 11|เซ็นเซ! เลเวล 12|เซ็นเซ! เลเวล 13|เซ็นเซ! เลเวล 14|เซ็นเซ! เลเวล 15|เซ็นเซ! เลเวล 16|เซ็นเซ! เลเวล 17|เซ็นเซ! เลเวล 18|เซ็นเซ! เลเวล 19|เซ็นเซ! เลเวลสูงสุด|＠
โต๊ะแห่งโชคชะตา|นั่งติดคนที่แอบชอบ|ยางลบที่ทำหล่น|แชร์หนังสือเรียน|การบ้านที่ลอกมา|แอบกระซิบกระซาบ|ฝันกลางวันในห้องเรียน|หลบหลีกดอดจ์บอล|แข่งกันไปที่โรงอาหาร|เรียนกับหล่อน|คอมเมนต์เตือนสติ|หัวข้อที่ไม่ได้เรียน|สัญลักษณ์มือของคนโกง|ความเจ็บปวดจากป๊อปควิซ|แทบจะไม่ผ่าน|ไม่มีหนังสือเรียน|ทำความสะอาดกับเธอ|อยู่ในใจฉันเสมอ|ช่วงติวสอบล้มเหลว|เกรดแล้วแต่พระเจ้า|＠
XP ขอบคุณ เลเวล 1|XP ขอบคุณ เลเวล 2|XP ขอบคุณ เลเวล 3|XP ขอบคุณ เลเวล 4|XP ขอบคุณ เลเวล 5|XP ขอบคุณ เลเวล 6|XP ขอบคุณ เลเวล 7|XP ขอบคุณ เลเวล 8|XP ขอบคุณ เลเวล 9|XP ขอบคุณ เลเวลสูงสุด|＠
เจ็บป่วยเลเวล 1|เจ็บป่วยเลเวล 2|เจ็บป่วยเลเวล 3|เจ็บป่วยเลเวล 4|เจ็บป่วยเลเวล 5|เจ็บป่วยเลเวล 6|เจ็บป่วยเลเวล 7|เจ็บป่วยเลเวล 8|เจ็บป่วยเลเวล 9|เจ็บป่วยเลเวล 10|＠
อีกครั้งเลเวล 11|อีกครั้งเลเวล 12|อีกครั้งเลเวล 13|อีกครั้งเลเวล 14|อีกครั้งเลเวล 15|อีกครั้งเลเวล 16|อีกครั้งเลเวล 17|อีกครั้งเลเวล 18|อีกครั้งเลเวล 19|อีกครั้งเลเวลสูงสุด|＠
เจ้าบ่าวตามหลอกหลอน|นักบวชปากดี|ผู้เข้าร่วมโปร่งใส|สุนทรพจน์ที่ถูกกลบเสียง|คณะประสานเสียงต้องคำสาป|ซอมบี้มังสวิรัติ|ออแกนเล่นอัตโนมัติ|แลกของขวัญภูติผี|น้ำมนต์จากก็อก|ฝังด้วยไมตรีจิต|＠
ดวลที่ทุ่งหญ้า (แนวหน้า)|ดวลที่ทุ่งหญ้า (อีลีท)|ดวลที่ทุ่งหญ้า (ผู้บัญชาการ)|ดวลยามอัสดง (แนวหน้า)|ดวลยามอัสดง (อีลีท)|ดวลยามอัสดง (ผู้บัญชาการ)|ดวลใต้ดวงดาว (แนวหน้า)|ดวลใต้ดวงดาว (อีลีท)|ดวลใต้ดวงดาว (ผู้บัญชาการ)|ดวลที่สันทราย (แนวหน้า)|ดวลที่สันทราย (อีลีท)|ดวลที่สันทราย (ผู้บัญชาการ)|ดวลที่ทุ่งลาวา (แนวหน้า)|ดวลที่ทุ่งลาวา (อีลีท)|ดวลที่ทุ่งลาวา (ผู้บัญชาการ)|ดวลใต้ทะเล (แนวหน้า)|ดวลใต้ทะเล (อีลีท)|ดวลใต้ทะเล (ผู้บัญชาการ)|＠
รอบก่อนรองชนะเลิศมือใหม่|รอบรองชนะเลิศมือใหม่|รอบชิงชนะเลิศมือใหม่|รอบก่อนรองชนะเลิศผู้เริ่มต้น|รอบรองชนะเลิศผู้เริ่มต้น|รอบชิงชนะเลิศผู้เริ่มต้น|รอบก่อนรองชนะเลิศมือสันทัด|รอบรองชนะเลิศมือสันทัด|รอบชิงชนะเลิศมือสันทัด|รอบก่อนรองชนะเลิศมือโปร|รอบรองชนะเลิศมือโปร|รอบชิงชนะเลิศมือโปร|รอบก่อนรองชนะเลิศระดับเชี่ยวชาญ|รอบรองชนะเลิศระดับเชี่ยวชาญ|รอบชิงชนะเลิศระดับเชี่ยวชาญ|รอบก่อนรองชนะเลิศชั้นครู|รอบรองชนะเลิศชั้นครู|รอบชิงชนะเลิศชั้นครู|＠
รุ่งอรุณแดงเลือด|รุ่งอรุณเริงร่า|รุ่งอรุณดำทะมึน|รุ่งอรุณศักดิ์สิทธิ์|รุ่งอรุณฟากฟ้า|รุ่งอรุณเน่าเฟะ|รุ่งอรุณเด็ดเดี่ยว|ปลายยอดแดงเลือด|ปลายยอดเริงร่า|ปลายยอดดำทะมึน|ปลายยอดศักดิ์สิทธิ์|ปลายยอดฟากฟ้า|ปลายยอดเน่าเฟะ|ปลายยอดเด็ดเดี่ยว|ที่หลบภัยแดงเลือด|ที่หลบภัยเริงร่า|ที่หลบภัยดำทะมึน|ที่หลบภัยศักดิ์สิทธิ์|ที่หลบภัยฟากฟ้า|ที่หลบภัยเน่าเฟะ|ที่หลบภัยเด็ดเดี่ยว|＠
ขบวนพาเหรดเลเวล 1|ขบวนพาเหรดเลเวล 2|ขบวนพาเหรดเลเวล 3|ขบวนพาเหรดเลเวล 4|ขบวนพาเหรดเลเวล 5|ขบวนพาเหรดเลเวล 6|ขบวนพาเหรดเลเวล 7|ขบวนพาเหรดเลเวล 8|ขบวนพาเหรดเลเวล 9|ขบวนพาเหรดเลเวลสูงสุด|＠
2012|2013 ตอนที่ 1|2013 ตอนที่ 2|2014 ตอนที่ 1|2014 ตอนที่ 2|2015 ตอนที่ 1|2015 ตอนที่ 2|2016 ตอนที่ 1|2016 ตอนที่ 2|2017 ตอนที่ 1|2017 ตอนที่ 2|2018 ตอนที่ 1|2018 ตอนที่ 2|2020 ตอนที่ 1|2020 ตอนที่ 2|2021 ตอนที่ 1|2021 ตอนที่ 2|2023 ตอนที่ 1|2023 ตอนที่ 2|2024|＠
ส่งของขวัญเลเวล 1|ส่งของขวัญเลเวล 2|ส่งของขวัญเลเวล 3|ส่งของขวัญเลเวล 4|ส่งของขวัญเลเวล 5|ส่งของขวัญเลเวล 6|ส่งของขวัญเลเวล 7|ส่งของขวัญเลเวล 8|ส่งของขวัญเลเวล 9|ส่งของขวัญเลเวลสูงสุด|＠
ปีเถาะเลเวล 1|ปีเถาะเลเวล 2|ปีเถาะเลเวล 3|ปีเถาะเลเวล 4|ปีเถาะเลเวล 5|ปีเถาะเลเวล 6|ปีเถาะเลเวล 7|ปีเถาะเลเวล 8|ปีเถาะเลเวล 9|ปีเถาะเลเวลสูงสุด|＠
การปกป้องถึงตายเลเวล 1|การปกป้องถึงตายเลเวล 2|การปกป้องถึงตายเลเวล 3|การปกป้องถึงตายเลเวล 4|การปกป้องถึงตายเลเวล 5|การปกป้องถึงตายเลเวล 6|การปกป้องถึงตายเลเวล 7|การปกป้องถึงตายเลเวล 8|การปกป้องถึงตายเลเวล 9|การปกป้องถึงตายเลเวลสูงสุด|＠
สามลางร้ายเลเวล 1|สามลางร้ายเลเวล 2|สามลางร้ายเลเวล 3|สามลางร้ายเลเวล 4|สามลางร้ายเลเวล 5|สามลางร้ายเลเวล 6|สามลางร้ายเลเวล 7|สามลางร้ายเลเวล 8|สามลางร้ายเลเวล 9|สามลางร้ายเลเวล 10|สามลางร้ายเลเวล 11|สามลางร้ายเลเวล 12|สามลางร้ายเลเวล 13|สามลางร้ายเลเวล 14|สามลางร้ายเลเวล 15|สามลางร้ายเลเวล 16|สามลางร้ายเลเวล 17|สามลางร้ายเลเวล 18|สามลางร้ายเลเวล 19|สามลางร้ายเลเวลสูงสุด|＠
ออกเดินทางยามเช้า|แมวในสำนักงาน|ว่างเปล่าเลยเหรอ?|โฮ่งกระโดดออก!|ระบำสุดพิลึก|สมุนไพรหมด|แมวโจมตีคริติคอล!|ตื่นมาตาเหล่|โต้รุ่ง|บ้านเกิดถูกทำลาย|มันคือกับดัก!|ไม้เท้าแห่งการเยียวยา|อุปกรณ์ต้องคำสาป|แมวของคุณกำลังวิวัฒน์...!|ผสมหลายคลาส|ดาบในศิลา|ทางลัดแคบ|ราชาหุ่นเชิด|คืนก่อนทำศึก|ไม่พบบันทึกข้อมูล|＠
ปีมะโรงเลเวล 1|ปีมะโรงเลเวล 2|ปีมะโรงเลเวล 3|ปีมะโรงเลเวล 4|ปีมะโรงเลเวล 5|ปีมะโรงเลเวล 6|ปีมะโรงเลเวล 7|ปีมะโรงเลเวล 8|ปีมะโรงเลเวล 9|ปีมะโรงเลเวลสูงสุด|＠
กระหายเลือดเลเวล 1|กระหายเลือดเลเวล 2|กระหายเลือดเลเวล 3|กระหายเลือดเลเวล 4|กระหายเลือดเลเวล 5|กระหายเลือดเลเวล 6|กระหายเลือดเลเวล 7|กระหายเลือดเลเวล 8|กระหายเลือดเลเวล 9|กระหายเลือดเลเวล 10|กระหายเลือดเลเวล 11|กระหายเลือดเลเวล 12|กระหายเลือดเลเวล 13|กระหายเลือดเลเวล 14|กระหายเลือดเลเวลสูงสุด|＠
การขุดเลเวล 1|การขุดเลเวล 2|การขุดเลเวล 3|การขุดเลเวล 4|การขุดเลเวล 5|การขุดเลเวล 6|การขุดเลเวล 7|การขุดเลเวล 8|การขุดเลเวล 9|การขุดเลเวล 10|การขุดเลเวล 11|การขุดเลเวล 12|การขุดเลเวล 13|การขุดเลเวล 14|การขุดเลเวล 15|การขุดเลเวล 16|การขุดเลเวล 17|การขุดเลเวล 18|การขุดเลเวล 19|การขุดเลเวลสูงสุด|＠
การผจญภัยครั้งใหม่|ปิดหมู่บ้านเลี้ยงส่ง|ชายชราขวางถนน|เดินทางไปปราสาทโฮ่ง|พลังชั่ว|เมฆทะมึน|เงาต้องลิขิต|ชาวบ้านไร้สติ|ออร่าชั่วร้าย|ราชาที่ถูกปั่นหัว|＠
ตื่นบนชายหาด|หนาวสั่นอยู่ในถ้ำ|SOS ที่ไม่มีใครเห็น|ปวดท้องจากเห็ดพิษ|ฝันที่จะได้หนีออกไป|ล่าสำเร็จ!|ประกอบแพขั้นต้น|ได้ออกไปซะที|แพจมเกลียวคลื่น|ยินดีต้อนรับกลับบ้าน แมวพักฤดูร้อน|＠
การรวมตัวภูตผี|นักล่าผีในเมือง|ประชาชนผีเข้า|อสูรในหมู่คน|ตำรวจปลอมมาช่วย|เกลือทรงประสิทธิภาพ|ธุรกิจกำจัดวิญญาณ|ตำแหน่งในภาพติดวิญญาณ|ท่าทางดื้อรั้น|ต้องจับมันให้ได้ทั้งหมด|＠
ปีมะเส็งเลเวล 1|ปีมะเส็งเลเวล 2|ปีมะเส็งเลเวล 3|ปีมะเส็งเลเวล 4|ปีมะเส็งเลเวล 5|ปีมะเส็งเลเวล 6|ปีมะเส็งเลเวล 7|ปีมะเส็งเลเวล 8|ปีมะเส็งเลเวล 9|ปีมะเส็งเลเวลสูงสุด|＠
ข้อพิพาททางการตลาด|ติดกับที่เช็กเอาท์|จอมล่าดีลเด็ด|ลดราคาลวง|ราคา vs คุณภาพ|โรคเสพติดช็อปปิ้ง|คูปองโปรยปราย|ข้อตกลงสุดโหด|ล้างสต็อก|ของขวัญลดราคาครั้งสุดท้าย|＠
ตื่นบนชายหาด|เมฆทะมึน|จับจ้องจากพงหญ้า|หนาวสั่นอยู่ในถ้ำ|SOS ที่ไม่มีใครเห็น|รอดชีวิต|ชีวิตในเมืองเกาะ|การรวมตัวอิสระ|ปวดท้องจากเห็ดพิษ|มิตรภาพธรรมชาติ|ฝันถึงการหลบหนี|ล็อกเป้า|ล่าสำเร็จ!|ความหิวคือรสชาติของชีวิต|ความหวังที่ปลายฟ้า|ประกอบแพขั้นต้น|ความทรงจำบนเกาะ|ได้ออกไปซะที|แพจมเกลียวคลื่น|ตื่นอีกครั้งบนชายหาด|＠
แลกเปลี่ยนวัฒนธรรมเลเวล 1|แลกเปลี่ยนวัฒนธรรมเลเวล 2|แลกเปลี่ยนวัฒนธรรมเลเวล 3|แลกเปลี่ยนวัฒนธรรมเลเวล 4|แลกเปลี่ยนวัฒนธรรมเลเวล 5|แลกเปลี่ยนวัฒนธรรมเลเวล 6|แลกเปลี่ยนวัฒนธรรมเลเวล 7|แลกเปลี่ยนวัฒนธรรมเลเวล 8|แลกเปลี่ยนวัฒนธรรมเลเวล 9|แลกเปลี่ยนวัฒนธรรมเลเวล สูงสุด|＠
