Un Mundo Nuevo|＠|||||||||||||
Crímenes contra el cosmos|Horizonte cero|Atardecer subatómico|La teoría gatotatoria|Protones, neutrones y bufones|Páramo neutrino|＠||||||||
Serranía Choco|Senda Modorra|Orilla Chiflada|Fiordo Fangoso|Cima Rayuela|Bosque Abracadabra|＠||||||||
Supernativos|Casa familiar de Infortunios|Pesca de IA|Cursillo de sacrificio|＠||||||||||||||||
Bahía Interesante|En la Boca del Tigre|Isla de Quesesto|Por Aquí Mal Canal|¡Madre ría!|Calle de la Amargura|Centro de la Ciudad Así Asá|Hoyo en Uno|＠||||||||||||
Costa Resacosa|Gran Barrera - gratis|Aviso de Aleta Ominosa|Dos Millas hacia Abajo|Hábitat de Cueva Marina|Más Allá del Lecho Marino|＠||||||||||||
Campo Furioso|Pradera Irreal|El Risco de Montecristo|La Bestia de Montecristo|Suerte en la Grava|Infortunio en la Grava|＠||||||||||||
Búsqueda del Entendimiento|Afluente Pitagórico|1 + 2 = Tor|Seno-Coseno Mío|Valle Isósceles|El Punto Más Lejano|＠||||||||||||