Un mondo nuovo|＠|||||||||||||
Crimini contro il cosmo|Orizzonte zero|Adrone al tramonto|La teoria felina|Protoni, neutroni e furbacchioni|Terra innevata di neutrino|＠||||||||
Cioccoaltipiani|Sentieri sonnolenti|Lago matto|Fiordo fangoso|Vetta della campana|Foresta abracadabra|＠||||||||
Nativi extra|Famiglia sfortunata|Pesca con l'IA|Tirocinio del sacrificio|＠||||||||||||||||
Ingresso interessante|Tigri all'arrembaggio|Isola Chidiavolosei|Can-Can Canale|Ma che corso d'acqua|Via Ohno|Centro città Così Così|Cava bella grande|＠||||||||||||
Risacca sulla costa|Grande barriera stupidina|Allarme pinna minacciosa|Due miglia sotto i mari|Habitat marino|Oltre l'adale|＠||||||||||||
Campo Furioso|Prato miraggio|Rupe di Monte Cristo|Bestia di Monte Cristo|Benedizioni nella sabbia|Sventura nella sabbia|＠||||||||||||
Alla ricerca della comprensione|Affluente pitagorico|1 + 2 = Torre|Miniera del coseno di poi|Valle Isoscele|Il punto più remoto|＠||||||||||||
Sofista non istruito|Una vita di antitesi|Foresta dell'ironia|Dialogo senza senso|Distesa delle calunnie|Aderenza alla virtù|＠||||||||||||