ネコカンが不足しています,ネコカンショップへ移動しますか？,＠, ,
アイテムが不足してます！,＠,　,　,
ネコカン30個で｢お金MAX｣、,｢にゃんこ砲発射可能｣な状態で,復活しますか？,＠,
ネコカンを使用しますが、,よろしいですか？,＠, ,
ネコカン30個で全回復しますか？,＠, , ,
統率力が不足しています。,ネコカン30個で全回復しますか？,＠, ,
統率力が不足しています。,経験値を貯めて,パワーアップ画面から,統率力をパワーアップしましょう。,＠,　,　,
現在の統率力はマックス状態です。,＠,　,　,　,　,
メインメニューに戻りますか？,＠,　, , , ,
全基本キャラゲット！,すべての基本キャラクターの入手,おめでとう！！,＠, , , ,
目指せクラスチェンジ！,キャラクターをレベル１０まで,パワーアップさせて,真の姿へとクラスチェンジさせるのだ！,＠, , , ,
レベル１０へ到達おめでとう！,キャラクターがクラスチェンジしました！,＠,,,,
キャラクターがクラスチェンジしました！,,,,,
経験値が不足しています。,アイテムショップで経験値を購入しますか？,＠, ,
これ以上ネコカンを,購入することができません!,＠,,,,,,
お宝が解放されていないので使用できません！,＠,　,　,
切り替えボタン解放！,パワーアップ画面などでキャラクターを,クラスチェンジ前の姿に切り替えることが,できるようになりました！,＠,　,　,
『トレジャーフェスティバル』開催中,お宝集めのビッグチャンス☆,今なら全ステージのお宝出現率が超UP！！,＠, , ,
『トレジャーチャンス』開催中,今なら特定ステージでの,お宝出現率が超UP！！,＠, , ,
アイテムロック,アイテムをロックしておけば,使用選択状態をキープすることができ、,毎回選択する必要が無くなります,
「ケリ姫」ゲット！,パワーアップ画面から無料で取得可能です。,＠, ,
新キャラクター「ネコひめ」ゲット！,パワーアップ画面から無料で取得可能です。,＠, , ,
#,経験値へ交換します,よろしいですか？,＠, , ,
キャラクターを取得しますか？,＠, , , , ,
キャラクターをパワーアップさせますか？,＠, , , , ,
にゃんこ貯蔵庫に送られました,＠, , , , ,
にゃんこ貯蔵庫がいっぱいの為、,ガチャをまわすことができません,＠, , , ,
通信してください。,＠, , , , ,
今日のガチャは終了しました。,＠, , , , ,
これ以上、パワーアップを,させることはできません！,＠, , , ,
レベルの上限が解放されました！,＠, , , , , ,
通信環境をチェックしてください。,#,＠, , , ,
このイベント期間が終了しました,マップ選択画面に戻ります。,＠, , , ,
合計レベル,で進化,＠, , , ,
#,貯蔵庫内にある全てのキャラクター達を,経験値ＸＰに交換します,よろしいですか？,＠, ,
本当にXPに交換してよろしいですか？,＠, , , ,
現在開催されている,イベントは何も無いにゃ！,通信環境の良い所で,再起動するにゃ！,＠,
イベントステージが解放！,タイトル画面から移動できます,＠, ,
タイトル画面に「レジェンドストーリー」が出現！,不定期に開催されるイベントステージも,「レジェンドストーリー」から挑戦できます,＠,
ガチャが解放！,ネコ基地にガチャが出現しました,＠, , , ,
新しいバージョンが公開されています,にゃんこ大戦争を,バージョンアップしてください,＠, , , ,
ガチャイベントエラー,＠, , , ,
このステージでは,神様は使用できません,＠, , ,
戦力をパワーアップしますか？,＠, , ,
このイベント期間が終了しています。,＠, , , , ,
EXキャラクター「,」ゲット！,パワーアップ画面から取得可能です。,＠, , ,
レアキャラ「,」ゲット！,パワーアップ画面から取得可能です。,＠, , ,
激レア「,」ゲット！,パワーアップ画面から取得可能です。,＠, , ,
超激レア「,」ゲット！,パワーアップ画面から取得可能です。,＠, , ,
所持している同じキャラクターなど全てをまとめてつかったり、XPにしたりできます。,＠, , ,
個をまとめて,＠, , ,
取得,レベル,MAX,+,
→,＠, , ,
※これ以上は強くできませんので,個だけ消費します,＠, , ,
ネコカンが,個不足しています。,ネコカンショップへ移動しますか？,＠, ,
${gatyaNumber}回連続ガチャを回してから30分以内に,もう一度${gatyaNumber}回連続ガチャを回すと、,なんとXP100万をプレゼント！,＠, , ,
#,がプレゼントされました！,＠, , ,
貯蔵庫内にある全てのキャラクター達を,まとめて使用します,よろしいですか？,＠, , ,
本当に使用して,よろしいですか？,＠, , ,
全てのキャラクター達を,使用しました。,※一部のキャラクターは使用できませんでした,＠, , ,
ずれていた時間を復帰手続き中です。,復帰するまでイベントステージやガチャはできません。,※復帰まで最大で2日程度かかる場合もございます。,(HGT02),＠, , ,
端末時刻にずれが発生しています。,端末時刻を正しい時刻に設定して下さい。,時刻のずれが解消されるまでは、イベントステージやガチャはできません。,(HGT01),
サーバーと通信が行われていないか、,端末時刻にずれが発生しています。,通信環境と端末時刻をご確認ください。,(HGT00),＠, , ,
「全キャラ」表示が追加されました！,取得済みキャラクターを一覧表示できます,パワーアップ画面などで選択可能です,＠, , , , ,
すでに「メルク」をゲットしています。,パワーアップ画面へ移動します。,＠, , , , ,
出陣スロットの数が追加！,キャラクター編成画面で編成を,３つまで保存可能になりました！,＠, , , , ,
このステージをプレイするには,１つ前のステージレベルのクリアが必要です,＠, , , , ,
${gatyaNumber}回連続ガチャを回せば、,超激レアキャラクターがかならず出現！,この機会、お見逃しなく！！,＠, , , , ,
リミット（限界レベル）になった青玉５個を,レアチケット１枚に交換できます,青玉を使いますか？,＠, , , , ,
青玉を,個消費して, レアチケット１枚ゲットしました！,＠, , , , ,
青玉を,個消費しました,あと青玉,個でレアチケットゲット！,＠, , , , ,
#,貯蔵庫内にある未取得キャラクター達を,まとめて経験値ＸＰに交換します,よろしいですか？,＠, ,
#,貯蔵庫内にあるレベルアップ可能な,キャラクター達を全てＸＰに交換します,よろしいですか？,＠, ,
#,貯蔵庫内にあるリミット(限界レベル）に,到達したキャラクター達を全てＸＰに,交換しますが、よろしいですか？,＠, ,
貯蔵庫内にある未取得キャラクター達を,まとめて取得します,よろしいですか？,＠, , ,
貯蔵庫内にあるレベルアップ可能な,キャラクター達を全てパワーアップします,よろしいですか？,＠, , ,
にゃんこ貯蔵庫内のリミットの,キャラクター達をまとめて使用します,よろしいですか？,＠, , ,
全てのキャラクター達を,取得しました。,※一部のキャラクターは使用できませんでした,＠, , ,
これ以上、レアチケットに交換,することができません！,＠, , , ,
レアチケット１枚,コラボイベント報酬をゲットしました！,＠, , ,
ユーザーランクが解放されました！,目標ランクに達すると報酬ゲット！,パワーアップ数の総合計がランク数になります,＠, , ,
現バージョンではこれ以上,報酬が設定されていません！,＠, , ,
激問 プレイボーナス！,ゲームをプレイしていただいたお礼に,ネコカン500個プレゼント！,＠,
Mr.Ninja!! Fever プレイボーナス！,ゲームをプレイしていただいたお礼に,ネコカン500個プレゼント！,＠,
すでにプレイボーナスを,取得済みです。,＠, ,
クローズド・ルーム プレイボーナス！,ゲームをプレイしていただいたお礼に,ネコカン500個プレゼント！,＠,
EXキャラクター,「,」第3形態ゲット！,合計レベル20以上で進化可能です,＠, , ,
レアキャラ,「,」第3形態ゲット！,合計レベル20以上で進化可能です,＠, , ,
激レア,「,」第3形態ゲット！,合計レベル20以上で進化可能です,＠, , ,
超激レア,「,」第3形態ゲット！,合計レベル20以上で進化可能です,＠, , ,
進化達成おめでとう！,キャラクターがクラスチェンジしました！,＠, , ,
第3形態に進化可能！,＠, , , , ,
ドロップ報酬,＠, , ,
EXキャラクター「,」ゲット！,＠, , ,
レアキャラ「,」ゲット！,＠, , ,
激レア「,」ゲット！,＠, , ,
超激レア「,」ゲット！,＠, , ,
パワーアップしました！,＠, , ,
限界レベルに到達しました！,＠, , ,
現段階では、これ以上プラスレベルを,パワーアップすることはできません！,＠, , ,
スコア報酬,＠, , ,
採点報酬ステージ,ステージクリア時に採点されるスコアに応じて,報酬がゲット出来るステージにゃ！,画面左下の「採点報酬」ボタンで報酬リストを確認出来るにゃ！,＠, , ,
Mr.Ninja!! Fever プレイボーナス！,ゲームプレイの特典として,ネコカン100個プレゼント！,＠, , , ,
Mr.Ninja!! Fever プレイボーナス！,ゲームプレイの特典として,EXキャラクター「ミスターニンジャ」,プレゼント！,＠, , ,
「にゃんコンボ」が解放されました！,キャラクターを組み合せてコンボスキル発動！,編成画面のにゃんコンボ図鑑で確認できます,＠, , , ,
未来編クリアおめでとう！,次の章も追加予定なので,アップデートを待って下さいにゃ！,＠,, , ,
中文版にゃんこ大戦争 プレイボーナス！,ゲームプレイの特典として,ネコカン150個プレゼント！,＠, , , ,
未来編が出現！,タイトル画面の未来編を選択すれば,新しいステージに挑戦できます！,＠, , , ,
ネコカン%d個で「出陣スロット%d」を追加します,※最大19スロットまで追加可能※,＠, , ,
全クリアボーナス！,にゃんコンボの新たな力をゲット！,キャラクター編成画面のにゃんコンボ図鑑で,確認可能です。,＠, , , ,
全クリアボーナス！,EXキャラクター,「ネコヴァルキリー」第3形態ゲット！,合計レベル20以上で進化可能です,＠, , ,
にゃんコンボ,「,」,ゲット！,「にゃんコンボ図鑑」で確認可能です。,＠, , , , ,
セール中！！ネコカン%d個のところ,ネコカン%d個で「出陣スロット%d」を追加します,※最大19スロットまで追加可能※,＠, , ,
未来編に新たな章が出現！,タイトル画面の未来編を選択すれば,新しい章に挑戦できます！,＠, , , ,
１００，０００ＸＰ,がプレゼントされました！,＠, , , ,
MH大狩猟チケット 30枚,がプレゼントされました！,＠, , , ,
レアガチャを回すと、1回につき,イベントチケット 1枚プレゼント！,期間限定のイベントガチャで使用できます,＠, , ,
%s %d枚,がプレゼントされました！,＠, , , ,
すでにコラボ特典をゲットしています,＠, , , , , ,
全クリアボーナス！,EXキャラクター,「ネコムート」第3形態ゲット！,合計レベル20以上で進化可能です,＠, , ,
３０，０００ＸＰ,コラボイベント報酬をゲットしました！,＠, , ,
にゃんこチケット３枚,コラボイベント報酬をゲットしました！,＠, , ,
このステージはコンテニュー出来ません,＠, , , ,
合計レベル,+素材で進化,＠, , , , ,
＠,＠,＠,＠, , ,
現バージョンでのレベル上限に達しています,＠, , , ,
${itemName1}を${itemNum1}個使用して,レベル上限を1つ解放します,よろしいですか？,＠, , , ,
レベル上限解放おめでとう！,レベル${level}までパワーアップ,出来るようになりました！,＠, , , ,
キャッツアイが不足しています,レベルの上限を解放するには,${itemName1}が${itemNum1}個必要です,＠, , , ,
ずれていた時間を復帰手続き中です。,復帰するまでにゃんこミッションはできません。,※復帰まで最大で2日程度かかる場合もございます。,(HGT02),＠, , ,
端末時刻にずれが発生しています。,端末時刻を正しい時刻に設定して下さい。,時刻のずれが解消されるまでは、にゃんこミッションはできません。,(HGT01),＠, , ,
リーダーシップ1個で全回復しますか？,＠, , ,
統率力が不足しています。,リーダーシップ1個で全回復しますか？,＠, ,
${itemName1}を${itemNum1}個,${itemName2}を${itemNum2}個使用して,レベル上限を1つ解放します,よろしいですか？,＠, , ,
${itemName1}を,使用しますが本当によろしいですか？,＠, , , ,
ネコカン%d個で「出陣スロット%d」を追加します,※解放条件：にゃんこメダル%d個以上獲得※,※最大19スロットまで追加可能※,＠, , ,
セール中！！ネコカン%d個のところ,ネコカン%d個で「出陣スロット%d」を追加します,※解放条件：にゃんこメダル%d個以上獲得※,※最大19スロットまで追加可能※,＠, , ,
%s %d個,がプレゼントされました！,＠, , , ,
特別キャラクター,%@,がにゃんこ貯蔵庫に送られました,＠, , ,
${charaName}は現在＋${level}までしか,パワーアップさせることができません,＠, , , ,
${itemName1}と,${itemName2}を,使用しますが本当によろしいですか？,＠, , , ,
${gatyaNumber}回連続ガチャを回してから30分以内に,もう一度${gatyaNumber}回連続ガチャを回すと、,XP100万と${itemName}${itemNum}個プレゼント！,＠, , ,
${itemName1}を${itemNum1}個消費して,レベル上限を解放しました！,レベル${level}までパワーアップできます,＠, , ,
『トレジャーフェスティバル』開催中,おひさしぶりの人にスペシャルチャンス☆,今なら全ステージのお宝出現率が超UP！！,＠, , ,