Friskat insufficiente|Vuoi andare al negozio Friskat?|＠||
Esaurito|＠|||
I tuoi soldi raggiungeranno il MASSIMO e il tuo|cannone felino verrà ricaricato per 30 Friskat.|Vuoi continuare? |＠|
Confermi di voler usare il Friskat?|＠|||
Vuoi usare 30 Friskat per un recupero completo?|＠|||
Energia felina insufficiente|Vuoi usare 30 Friskat per un recupero completo?|＠||
Energia felina insufficiente|Ottieni altri XP|e aumenta la tua energia felina|nella schermata Potenzia.|＠||
Energia felina al MASSIMO.|＠|||
Vuoi tornare al menu principale?|＠|||
Tutti i Gatti base sono stati sbloccati!|Congratulazioni!|＠|||
Via all'evoluzione!|Vediamo di cambiare classe!|Potenzia il tuo gatto al livello 10|per sbloccare Cambia classe!|＠||
Congratulazioni per aver raggiunto il LIVELLO 10!|Il gatto ha cambiato classe!|＠||
Il gatto ha cambiato classe!||||
XP insufficienti.|Vuoi acquistare XP nel negozio?|＠||
Non puoi avere altro Friskat!|＠|||
Non hai ancora sbloccato i tesori felini!|＠|||
Pulsante Cambia classe sbloccato!|Ora puoi alternare tra diverse|classi per i Gatti evoluti!|＠|||
È in corso "Festival del tesoro felino"!|È la tua occasione per ottenere dei tesori felini!|Maggiori ricompense con i tesori felini!|＠|||
È in corso "Trova un tesoro felino"!|È la tua occasione per ottenere dei tesori felini!|Attivo in livelli specifici! Cercali!|＠||
Blocca oggetto|Blocca gli oggetti per continuare a usarli|quando procedi da un livello all'altro.|Userai un oggetto per livello.||
Hai il nuovo personaggio "Kerihime"!|È accessibile dalla schermata di potenziamento.|＠||
Hai il nuovo personaggio "Principessa Gatto"!|È accessibile dalla schermata di potenziamento.|＠||
#|Confermi di voler|scambiare per XP?|＠||
Vuoi sbloccare questo personaggio?|＠|||
Vuoi potenziare questo personaggio?|＠|||
Inviato nella Rimessa felina|＠|||
Impossibile sorteggiare una Miaocapsula|perché non c'è più spazio nella Rimessa felina.|＠||
Connettiti al server.|＠|||
Il sorteggio odierno della Miaocapsula è terminato.|＠|||
Non puoi potenziarlo|ulteriormente!|＠||
È stato raggiunto il livello massimo.|＠|||
Controlla lo stato della tua rete.|#|＠||
Questo evento è terminato.|Ritorno alla schermata precedente.|＠||
Serve livello totale: | per evolvere|＠||
#|Tutti gli oggetti nella Rimessa felina|verranno scambiati per XP.|Vuoi continuare?|＠||
Vuoi scambiare per XP?|＠||
Non sono stati trovati eventi|al momento.|Spostati in un punto con|un segnale di rete migliore!|＠||
È uscito un nuovo livello evento!|Puoi accedervi dalla schermata del titolo.|＠||
I livelli leggendari sono stati sbloccati!|Livelli speciali e Saghe leggendarie|sono disponibili in questa sezione!|＠||
Il distributore di Miaocapsule è stato sbloccato!|Puoi accedervi dalla Base felina.|＠||
È uscita una nuova versione di|The Battle Cats.|Aggiorna il gioco.|＠||
Errore Miaocapsule!|＠||
Nei livelli leggendari|non c'è il Gatto divino.|＠||
Confermi di voler potenziare questo potere?|＠||
La durata dell'evento è scaduta|＠||
Hai sbloccato un gatto speciale "|"|Ottienilo nel menu Potenzia!|＠||
Hai sbloccato un gatto raro "|"|Ottienilo nel menu Potenzia!|＠||
Hai sbloccato un gatto super raro "|"|Ottienilo nel menu Potenzia!|＠||
Hai sbloccato un gatto ultra raro "|"|Ottienilo nel menu Potenzia!|＠||
Se possiedi già quel gatto, allora puoi usarli insieme o scambiarli tutti per XP|＠||
 verranno usati.|＠||
Ricevuto|Livello |Max| + ||
→|＠||
Verrà raggiunto il limite di livello, quindi | sarà solo usato.|＠||
Hai bisogno di |Friskat.|Vuoi andare al negozio Friskat?|＠||
Dopo un sorteggio a ${gatyaNumber} capsule, prova un|altro sorteggio a ${gatyaNumber} entro 30 minuti per ottenere|un bonus di 1.000.000 XP!|＠|||
#|ricevuto in regalo.|＠||
Tutte le capsule nella Rimessa|verranno attivate.|Vuoi continuare?|＠||
Vuoi|continuare?|＠||
Tutte le Miaocapsule possibili|sono state usate.| Ci sono dei rimasugli.|＠||
Il gioco è in modalità recupero per un problema con l'orario del dispositivo. | Potrai accedere ai livelli evento o sorteggiare capsule solo a recupero ultimato.| Ci vorranno al massimo 2 giorni per il completamento del recupero.|(HGT02)|＠||
Si è verificato un problema con l'orario del dispositivo.| Ripristina l'orario del dispositivo alle impostazioni corrette.| Potrai accedere ai livelli evento o sorteggiare capsule solo a ripristino ultimato.|(HGT01)|＠||
Comunicazione con il server fallita in seguito a | problemi con l'orario del dispositivo.| Verifica che l'orario del dispositivo e le comunicazioni di rete siano corretti.|(HGT00)|＠||
Tutti i filtri attivati!|Puoi vedere tutte le capsule nella Rimessa.| Accedi al menu Potenzia e dai un'occhiata!|＠||
||||
Formazioni da battaglia aumentate!|Ora puoi preparare fino a tre formazioni|accedendo alla schermata Equipaggia.|＠||
Bisogna superare un livello precedente|prima di poter affrontare questo livello.|＠||
Quando fai un sorteggio a ${gatyaNumber} capsule|per questo evento, avrai un gatto ultra raro|garantito! Non perderlo!|＠|||||
Scambia 5 Miaocapsule che non puoi |più usare per ricevere un Biglietto raro.|Vuoi scambiare capsule?|＠||
Hai scambiato | Miaocapsule per|%d miaobiglietto/i raro/i!|＠||
Hai scambiato |capsula/e per un Biglietto raro!|Scambiane ancora|per ricevere il tuo Biglietto!|＠||
#|Tutti gli oggetti nella Rimessa felina|verranno scambiati per XP.|Vuoi procedere?|＠||
#|Tutti gli oggetti utilizzabili nella Rimessa|verranno scambiati per XP.|Vuoi procedere?|＠||
#|Tutti gli oggetti inutilizzabili nella Rimessa|verranno scambiati per XP.|Vuoi procedere?|＠||
Tutti i gatti non ancora ottenuti verranno|usati e aggiunti nella tua armata felina.|Vuoi procedere?|＠||
Tutti i gatti che possono essere potenziati|verranno potenziati.|Vuoi procedere?|＠||
Tutte le unità Gatto oltre la capacità della Rimessa|verranno attivate.|Vuoi procedere?|＠||
Tutte le unità Gatto sono state attivate!|* Alcuni gatti potrebbero non essere|utilizzabili in questo momento.|＠||
Impossibile effettuare altri scambi|per miaobiglietti rari!|＠||
Ricompensa evento collaborazione:|un Biglietto raro ottenuto!|＠||
Grado giocatore sbloccato!|Raggiungi il Grado indicato per ottenere ricompense!|Il Grado è determinato dal punteggio totale di potenziamento.|＠||
Hai sbloccato tutte le ricompense disponibili|per ora... Presto ne arriveranno altre!|＠||
Bonus partita Risolvi+!|Ricevi 500 Friskat.|per aver provato Risolvi+|＠||
Bonus partita Febbre da Mr. Ninja!|Ricevi 500 Friskat.|per aver provato Febbre da Mr. Ninja!|＠||
Spiacenti, hai già ricevuto un bonus partita.|＠|||
|||||
Unità speciale:||- Forma Reale ottenuta!|Evolvi dopo aver raggiunto il livello 20!|＠||
Unità rara:||- Forma Reale ottenuta!|Evolvi dopo aver raggiunto il livello 20!|＠||
Unità super rara:||- Forma Reale ottenuta!|Evolvi dopo aver raggiunto il livello 20!|＠||
Unità ultra rara:||- Forma Reale ottenuta!|Evolvi dopo aver raggiunto il livello 20!|＠||
Complimenti! Il tuo gatto si è evoluto!|Ora questa unità ha una nuova classe!|＠||
Possibilità di evolvere in una Forma Reale!|＠||
Ricompense|＠||
Hai ricevuto l'unità speciale "|"!|＠||
Hai ricevuto l'unità rara "|"!|＠||
Hai ricevuto l'unità super rara "|"!|＠||
Hai ricevuto l'unità ultra rara "|"!|＠||
Potenziamento avvenuto!|＠||
Livello MASSIMO raggiunto!|＠||
Non puoi più potenziare oltre|il livello attuale... per ora!|＠||
Ricompense punteggio|＠||
Livello con punteggio a tempo|Ottieni ricompense superando un punteggio|basato sul tempo impiegato a superare il livello!|Tocca il pulsante "Punteggio a tempo" per vedere i premi!|＠||
Ricevi il regalo di Mr. Ninja!|Hai vinto 100 Friskat per aver superato|il tutorial "Febbre da Mr. Ninja!"|＠||
Ricevi il regalo di Mr. Ninja!|Hai vinto un'unità speciale per aver giocato|alla modalità avventura "Febbre da Mr. Ninja!"|＠|||
Combo felina sbloccata!|Organizza le tue unità per sbloccare un super bonus!|Consulta il menu Lista combo per maggiori informazioni!|＠||
Complimenti, ha superato "Verso il futuro"!|Presto appariranno altri capitoli,|quindi non perderti il prossimo aggiornamento!|Fino ad allora, prova a trovare tutti i tesori!|＠||
|||＠||
È apparsa una nuova avventura!|Seleziona "Verso il futuro" dalla schermata del titolo|per affrontare questa nuova sfida!|＠||
Usa %d Friskat per aggiungere 1 slot.|*Sblocca fino a 19 slot*|＠||||
Bonus piazza pulita!|Hai sbloccato una nuova combo felina!|Consulta il menu Lista combo per maggiori|informazioni sulla tua nuova abilità.|＠||
Bonus piazza pulita!|Personaggio speciale:|Hai sbloccato la Forma Reale di Gatto Valchiria!|Fallo evolvere al livello 20 per usarlo!|＠||
La combo felina:|||è stata sbloccata!|Consulta il menu Lista combo per maggiori informazioni!|＠||
In Offerta! Costo ridotto da %d|a %d Friskat per sbloccare slot formazione # %d.|*Sblocca fino a 19 slot*|＠|||
È arrivato un nuovo capitolo della saga sul futuro!|Seleziona "Verso il futuro" dalla schermata del titolo|per affrontare questa nuova sfida!|＠||
Hai ricevuto|100.000 XP!|＠||
You got|30 Monster Hunter Tickets!|＠||
Sorteggia una capsula rara per un|Biglietto evento bonus!|Solo durante questo evento limitato!|＠||
Hai ricevuto in regalo|%d x %s!|＠||
Hai già ottenuto questo regalo collaborazione.|＠||
Bonus piazza pulita!|Personaggio speciale:|Hai sbloccato la Forma Reale di Gatto Bahamut!|Fallo evolvere al livello 20 per usarlo!|＠||
Hai ricevuto una ricompensa evento collaborazione!|30.000 XP|＠||
Hai ricevuto una ricompensa evento collaborazione!|3 miaobiglietti|＠||
In questo livello non sono permessi Continua.|＠||
Serve livello totale | e oggetti evoluzione|＠||
＠|＠|＠|＠||
Livello massimo per la versione attuale raggiunto.|＠||
Usa ${itemName1} x${itemNum1} per|aumentare il livello max di 1.|Confermi?|＠||
Livello max aumentato!|Ora puoi potenziare|al livello ${level}!|＠||
Occhio di gatto insufficiente.|Aumentare il livello max|richiede ${itemName1} x${itemNum1}.|＠||
Attualmente in modalità recupero dell'orario del dispositivo.|Le Sfide Erba gatta non possono essere completate|fino al termine della procedura. (HGT02)|* Attendi 48 ore per il recupero.|＠||
L'orario del dispositivo sembra essere stato modificato.|Conferma di avere impostato correttamente l'orario, poi|non effettuare ulteriori modifiche. (HGT01)|Le missioni potranno essere completate dopo il recupero.|＠||
Usa 1 Leadership per un recupero completo?|＠|||
Non hai sufficiente energia!|Vuoi recuperare tutta l'energia con 1 Leadership?|＠||
Usa ${itemName1} x${itemNum1}|e ${itemName2} x${itemNum2}|per aumentare il livello max di uno.|Confermi?|＠|||
Utilizzerai ${itemName1}.|Confermi di volerlo fare?|＠||||
Usa %d Friskat per sbloccare lo slot # %d.|*Prima devi raccogliere %d Miaodaglie*|*Sblocca fino a 19 slot*|＠|||
In Offerta! Costo ridotto da %d|a %d Friskat per sbloccare slot formazione # %d.|*Prima devi raccogliere %d Miaodaglie*|*Sblocca fino a 19 slot*|＠|||
%s x %d|ricevuto/i!|＠||||
Gatto limitato|%@|inviato nella Rimessa.|＠|||
${charaName} non può essere potenziato oltre ${level}|in questo momento.|＠||||
Utilizzerai ${itemName1} e|${itemName2}.|Confermi di volerlo fare?|＠||||
Dopo un sorteggio a ${gatyaNumber} capsule, prova un|altro sorteggio a ${gatyaNumber} entro 30 minuti per ottenere|1.000.000 XP e ${itemName} x ${itemNum}!|＠|||
Hai scambiato ${itemName1} x ${itemNum1} |per aumentare il livello max!|Ora puoi potenziare al livello ${level}!|＠|||