avec Hippo.|		//ガマトト探検ログ表示：目的語（ランダム生成）
après avoir été pris en otage.|
à Beverly Hills.|
dans une jungle pleine d’insectes.|
sur un gratte-ciel !|
dans un vieux tombeau.|
pendant un double typhon.|
dans un parc à thème délabré.|
au bureau du chômage.|
dans le 9e cercle de l'enfer.|
sur les Champs-Élysées.|
dans un resto de nuit.|
avec un mystérieux étranger.|
pendant une réunion de famille.|
avec un ami d’enfance.|
avec un clochard errant.|
avec le Dieu des Chats.|
avec un voisin détestable.|
avec son tout premier amour.|
pendant un rendez-vous.|
pendant une quête initiatique.|
en remplissant des papiers.|
avec le Professeur Bun-Bun.|
en prison.|
lors d’une chute de 5 km.|
dans un centre commercial.|
dans les embouteillages.|
en cours de coaching perso.|
avec un joli sourire.|
dans un club guindé.|
dans un souterrain.|
en pleine forêt.|
en soins intensifs.|
avec Chat gambettes.|
grâce à Camela.|
avec Toutou.|
pour raisons sentimentales.|
à cause d’un coup de chaleur.|
avec une créature obscène.|
dans un maid café.|
à un mariage.|
à un concert de death metal.|
après avoir rencontré Moneko.|
sur les lieux du crime.|
dans les toilettes publiques.|
dans un bus de ville.|
dans un entrepôt désaffecté.|
en crochetant une serrure.|
à cause des Illuminati.|
grâce à une pyramide de Ponzi.|
dans un bar mal famé.|
chez ses parents.|
à un show de Broadway.|
à un speed dating.|
pendant une réunion scolaire.|
sous les cerisiers.|
à sa fête de retraite.|
après un tir à 3 points.|
à son premier jour d’école.|
et a compris le sens de la vie.|
à un casino de Las Vegas.|
à l’aéroport.|
dans une bibliothèque .|
dans un café à Milan.|
pendant un braquage tendu.|
à un rodéo au Texas.|
à la coupe du monde.|
en haut du Mont Fuji.|
à la plage de Bondi.|
après une blague ratée.|
au Parthénon.|
en mangeant devant la TV.|
pendant une partie de hockey.|
après avoir rejoint l’armée.|
avec une personne inconnue.|
avec le voisin d’à côté.|
grâce au caïd de l’école.|
en se reposant à l’ombre.|
dans les Alpes suisses.|
pendant un tremblement de terre.|
après avoir gagné l’Iditarod.|
en conférence de presse.|
à une réunion d’actionnaires.|
après une rupture difficile.|
en souffrant atrocement.|
à un restaurant 3 étoiles.|
à l’article de la mort.|
dans la Chambre des secrets.|
à la crèche.|
pendant un blizzard soudain.|
après une trahison inattendue.|
en pilotant un hélicoptère.|
sous un grand ciel bleu.|
après avoir perdu son groupe.|
au magasin de jouets.|
en faisant du monocycle.|
à la sécurité de l’aéroport.|
à un anniversaire d’enfant.|
en plein Bombay.|
en vacances à Bali.|
à côté de son beau-père.|
dans une bambouseraie.|
dans un bazar bondé.|
dans un fast-food.|
en digérant de mauvais sushis.|
à des sources chaudes.|
dans sa voiture.|
en regardant l’heure.|
après avoir accédé au paradis.|
au retrait des bagages.|
dans le désert.|
dans un éclair blanc aveuglant.|
en tirant avec le Chanon.|
au bord d’une falaise.|
pendant le générique de fin.|
au centre de la Terre.|
à un anniversaire au bureau.|
en consultant ses messages.|
au nom de la science.|
au royaume des rats.|
dans un hôpital abandonné.|
sur un chalutier en Alaska.|
avec une célèbre actrice.|
sur un bateau qui coule.|
devant son méchant patron.|
après avoir gagné un prix.|
en regardant les étoiles.|
avec le principal du collège.|
au Yankee Stadium.|
pendant un pénalty.|
à un stand de kebab.|
au salon de coiffure.|
à un entretien d’embauche.|
avec l’infirmière scolaire.|
au bal du lycée.|
avec un vendeur de voitures.|
avec un vieil ermite.|
devant l’arbre légendaire.|
pendant un interrogatoire.|
à un marché aux puces.|
pendant le carnaval.|
sans comprendre pourquoi.|
dans un quartier résidentiel.|
devant le miroir.|
dans une berline noire.|
au sauna.|
dans le vestiaire des filles.|
en se cachant au grenier.|
devant un coucher de soleil.|
au cinéma.|
aux sélections du foot.|
dans un taxi crasseux.|
à la base féline.|
avec un voleur de vélo.|
en se cachant dans une benne.|
dans son bain.|
sur un lac gelé.|
à la Cyber Académie.|
depuis le purgatoire.|
avec un acteur de téléfilm.|
après un duel avec un Vajira.|
dans la base ennemie.|
en tenant une tasse de thé.|
en écrivant une lettre d’amour.|
à l’université de Nyarvard.|
dans le château ambulant de Jizo.|
dans l’atelier de Mekako.|
dans un lieu top secret.|
dans la Silicon Valley.|
à son récital de piano.|
chez le docteur.|
dans un avion cargo.|
sur la tombe de son aïeul.|
en cours de yoga.|
pour circonstances familiales.|
dans une rame de métro bondée.|
en essayant d’attraper un oiseau.|
en regardant une émission triste.|
pendant une folle poursuite.|
aux prises avec le vertige.|
après son passage à la TV.|
en interrogeant des experts.|
après s’être fait gronder.|
avec son groupe de K-pop.|
à une base dans l’Arctique.|
en menant une révolution.|
avec un chupacabra.|
à un moment de désespoir.|
après avoir perdu sur le ring.|
après avoir étudié toute la nuit.|
en sortie avec papi.|
en lâchant son portefeuille.|
en textant au volant.|
après une demande romantique.|
après une session karaoké.|
après un lourd traumatisme.|
à la pizzeria.|
pendant un job à mi-temps.|
pendant les examens finaux.|
au bas de Taipei 101.|
sur un bateau pour Singapour.|
dans les rues de Manille.|
quand Sire Phoque attaquait !|
en cuisinant un ragoût.|
en se faisant enterrer.|
après avoir attrapé une crampe.|
en remuant les bras sans raison.|
après avoir acquis des pouvoirs mutants.|
sous anesthésie.|
à une soirée pyjama.|
en portant une jolie jupe.|
en sortant de la gym.|
dans un village ninja.|
pendant un exorcisme.|
après avoir écrit ses mémoires.|
avec un vieux bagarreur.|
à l’arrêt de bus.|
en jouant à la balle aux prisonniers.|
après avoir perdu sa queue.|
en rêvant de son senpai.|
après 72 h de séries télé.|
après avoir mangé un gâteau.|
en chevauchant un alligator.|
le dernier jour de l’été.|
pendant une panne de courant.|
après une lobotomie.|
au bazar à un euro.|
＠|