Un mondo nuovo|＠|||||||||||||
Crimini contro il cosmo|Orizzonte zero|Adrone al tramonto|La teoria felina|Protoni, neutroni e furbacchioni|Terra innevata di neutrino|＠||||||||
Cioccoaltipiani|Sentieri sonnolenti|Lago matto|Fiordo fangoso|Vetta della campana|Foresta abracadabra|＠||||||||
Nativi extra|Famiglia sfortunata|Pesca con l'IA|Tirocinio del sacrificio|＠||||||||||||||||
Ingresso interessante|Tigri all'arrembaggio|Isola Chidiavolosei|Can-Can Canale|Ma che corso d'acqua|Via Ohno|Centro città Così Così|Cava bella grande|＠||||||||||||
Risacca sulla costa|Grande barriera stupidina|Allarme pinna minacciosa|Due miglia sotto i mari|Habitat marino|Oltre l'adale|＠||||||||||||
Campo Furioso|Prato miraggio|Rupe di Monte Cristo|Bestia di Monte Cristo|Benedizioni nella sabbia|Sventura nella sabbia|＠||||||||||||
Alla ricerca della comprensione|Affluente pitagorico|1 + 2 = Torre|Miniera del coseno di poi|Valle Isoscele|Il punto più remoto|＠||||||||||||
Sofista non istruito|Una vita di antitesi|Foresta dell'ironia|Dialogo senza senso|Distesa delle calunnie|Aderenza alla virtù|＠||||||||||||
Permesso di atterraggio|Grandi e piccoli passi|Giardino Burger|Piccolo ingresso, grande campo|Sogno effervescente|Porto Prateria|＠
Strada serpeggiante|Foto di un secondo|Metaverso metallico|Mercante di ananas|Grattaterra|Sialia fantasma|＠
Cimitero dei fagioli di soia|Lago a punta|Pioggia di dolciumi|Arcipelago di yogurt|Rovine tagliabiscotti|Paesaggio pop-pop|＠
Mar Yodoyo|Prigione putrida|Isolamento da inquinamento|Mutazione assurda|Tossicità accidentale|Omuncolo sincero|＠
Cattedrale prefabbricata|Pisolino postprandiale|Giardino infestato|Parata veloce|Spiaggia privata|Emigrazione costosa|＠
Rotta di Fleming|Giungla antimaterica|Flusso zero inerte|Entropia tropicale|Arcipelago di Eulero|Frutto anti paradiso|＠
Capitano misterioso|La cabina chiusa a chiave|Proposta in mezzo al mare|Distacco digitale|Pirati che rompono i ranghi|Attracco senza intoppi|＠
Guardiano inetto|Trappola tenera|Labirinto trasportatore|Dissidente gioviale|Botola illuminata|Deposito non tanto segreto|＠
Lancio del bambucottero|Yo-Yo ampiafoglia|Palude di marmo|Alga fischietto|Contrafforte di Trompo|Cascata adorata|＠
Pensilina fluttuante|Residence corallo|Relitto ristrutturato|Museo dell'inchiostro|Campeggio delle alghe|Osservatorio cianfrusaglie|＠